---
title: Credit Market Solutions
parent_directory: FINM Credit Markets
formatted: 2025-12-21 06:45:00 AM
formatter_model: grok-code-fast-1
cli-tool: opencode
primary_tags:
   - credit market analysis
   - treasury bond pricing
   - corporate bond valuation
secondary_tags:
   - bond symbology
   - yield curve construction
   - quantitative finance
   - fixed income securities
cssclasses: academia
---

# Credit Market Solutions

<hr><font color="green"><h1>from file: 1UChicago_FINM_35700_CreditMarkets_Spring2024_Solution_1</h1></font>

## Solution to Homework 1

## FINM 35700 - Spring 2024

### UChicago Financial Mathematics

* Alex Popovici
* alex.popovici@uchicago.edu

This homework relies on:

- the government and corporate bonds symbology file `bond_symbology`, 
- the "on-the-run" treasuries data file `govt_on_the_run` and
- the market data file `bond_market_prices_eod`.

You can find more details on US treasury instruments in the FINM 37400 Fixed Income course.

```python
import QuantLib as ql
import pandas as pd
import numpy as np
from matplotlib import pyplot as plt
import seaborn as sns
```

# Problem 1: Explore symbology for US treasuries and corporate bonds

## a. Load and explore US government bond symbology

Load the `bond_symbology` Excel file into a dataframe. It contains symbology for both government and corporate bonds. 

Select US Treasury bonds only (class = 'Govt', ticker = 'T'). For each government bond issue, calculate its initial term/time-to-maturity in years (based on issue date and maturity date), as well as the current time-to-maturity. Assume a year has 365.25 days (alternatively, use QuantLib yearFraction function).

```python
# Load bond_symbology.xlsx
bond_symbology = pd.read_excel('./data/bond_symbology.xlsx')

# Set as-of-date
as_of_date = pd.to_datetime('2024-04-01')

# Add term and TTM columns
bond_symbology['term'] = (bond_symbology['maturity'] - bond_symbology['start_date']).dt.days / 365.25
bond_symbology['TTM'] = (bond_symbology['maturity'] - as_of_date).dt.days / 365.25

# Create Govt bonds symbology df
govt_symbology = bond_symbology[(bond_symbology['class'] == 'Govt') 
                                   & (bond_symbology['ticker'] == 'T')].copy()

# Display govt_symbology
display(govt_symbology.head())


```

<div>
<style scoped>
	.dataframe tbody tr th:only-of-type {
		vertical-align: middle;
	}

    .dataframe tbody tr th {
        vertical-align: top;
    }

    .dataframe thead th {
        text-align: right;
    }
</style>
<table border="1" class="dataframe">
  <thead>
	<tr style="text-align: right;">
	  <th></th>
	  <th>ticker</th>
	  <th>class</th>
	  <th>figi</th>
	  <th>isin</th>
	  <th>und_bench_isin</th>
	  <th>security</th>
	  <th>name</th>
	  <th>type</th>
	  <th>coupon</th>
	  <th>cpn_type</th>
	  <th>…</th>
	  <th>acc_first</th>
	  <th>maturity</th>
	  <th>mty_typ</th>
	  <th>rank</th>
	  <th>amt_out</th>
	  <th>country</th>
	  <th>currency</th>
	  <th>status</th>
	  <th>term</th>
	  <th>TTM</th>
	</tr>
  </thead>
  <tbody>
	<tr>
	  <th>329</th>
	  <td>T</td>
	  <td>Govt</td>
	  <td>BBG000DKHP42</td>
	  <td>US912810EG95</td>
	  <td>US9127963M90</td>
	  <td>T 8 3/4 08/15/20</td>
	  <td>US TREASURY N/B</td>
	  <td>US GOVERNMENT</td>
	  <td>8.750</td>
	  <td>FIXED</td>
	  <td>…</td>
	  <td>1990-08-15</td>
	  <td>2020-08-15</td>
	  <td>NORMAL</td>
	  <td>Unsecured</td>
	  <td>17059.0</td>
	  <td>US</td>
	  <td>USD</td>
	  <td>INAC</td>
	  <td>30.001369</td>
	  <td>-3.627652</td>
	</tr>
	<tr>
	  <th>330</th>
	  <td>T</td>
	  <td>Govt</td>
	  <td>BBG000DJN4B7</td>
	  <td>US912810EH78</td>
	  <td>NaN</td>
	  <td>T 7 7/8 02/15/21</td>
	  <td>US TREASURY N/B</td>
	  <td>US GOVERNMENT</td>
	  <td>7.875</td>
	  <td>FIXED</td>
	  <td>…</td>
	  <td>1991-02-15</td>
	  <td>2021-02-15</td>
	  <td>NORMAL</td>
	  <td>Unsecured</td>
	  <td>10076.0</td>
	  <td>US</td>
	  <td>USD</td>
	  <td>INAC</td>
	  <td>30.001369</td>
	  <td>-3.123888</td>
	</tr>
	<tr>
	  <th>331</th>
	  <td>T</td>
	  <td>Govt</td>
	  <td>BBG000DHBM88</td>
	  <td>US912810EJ35</td>
	  <td>NaN</td>
	  <td>T 8 1/8 05/15/21</td>
	  <td>US TREASURY N/B</td>
	  <td>US GOVERNMENT</td>
	  <td>8.125</td>
	  <td>FIXED</td>
	  <td>…</td>
	  <td>1991-05-15</td>
	  <td>2021-05-15</td>
	  <td>NORMAL</td>
	  <td>Unsecured</td>
	  <td>10067.0</td>
	  <td>US</td>
	  <td>USD</td>
	  <td>INAC</td>
	  <td>30.001369</td>
	  <td>-2.880219</td>
	</tr>
	<tr>
	  <th>332</th>
	  <td>T</td>
	  <td>Govt</td>
	  <td>BBG000DKP182</td>
	  <td>US912810EK08</td>
	  <td>NaN</td>
	  <td>T 8 1/8 08/15/21</td>
	  <td>US TREASURY N/B</td>
	  <td>US GOVERNMENT</td>
	  <td>8.125</td>
	  <td>FIXED</td>
	  <td>…</td>
	  <td>1991-08-15</td>
	  <td>2021-08-15</td>
	  <td>NORMAL</td>
	  <td>Unsecured</td>
	  <td>9506.0</td>
	  <td>US</td>
	  <td>USD</td>
	  <td>INAC</td>
	  <td>30.001369</td>
	  <td>-2.628337</td>
	</tr>
	<tr>
	  <th>333</th>
	  <td>T</td>
	  <td>Govt</td>
	  <td>BBG000DFRYP0</td>
	  <td>US912810EL80</td>
	  <td>NaN</td>
	  <td>T 8 11/15/21</td>
	  <td>US TREASURY N/B</td>
	  <td>US GOVERNMENT</td>
	  <td>8.000</td>
	  <td>FIXED</td>
	  <td>…</td>
	  <td>1991-11-15</td>
	  <td>2021-11-15</td>
	  <td>NORMAL</td>
	  <td>Unsecured</td>
	  <td>30632.0</td>
	  <td>US</td>
	  <td>USD</td>
	  <td>INAC</td>
	  <td>30.001369</td>
	  <td>-2.376454</td>
	</tr>
  </tbody>
</table>
<p>5 rows × 25 columns</p>
</div>

## b. Historical time series of US treasury coupons 

Plot the time series of coupons for for US treasury notes/bonds issued in the last 10 years (indexed by issue date). 

What can you say about the overall level of issued coupons in the last 4 years?

```python
# 10y cut-off date
cut_off_date_10y = pd.to_datetime('2014-04-01')
govt_symbology_10y = govt_symbology[govt_symbology['start_date'] >= cut_off_date_10y].copy()

# Plot the US Treasury coupons by issue date (last 10 years)
govt_symbology_10y.plot(x='start_date', y='coupon', grid=True, style='-*', title='US Treasury coupons by issue date (last 10 years)', figsize=(12,8))
```

    <Axes: title={'center': 'US Treasury coupons by issue date (last 10 years)'}, xlabel='start_date'>




    

![png](output_9_1.png)

```python
# 4y cut-off date
cut_off_date_4y = pd.to_datetime('2020-04-01')
govt_symbology_4y = govt_symbology[govt_symbology['start_date'] >= cut_off_date_4y].copy()

# Plot the US Treasury coupons by issue date (last 10 years)
govt_symbology_4y.plot(x='start_date', y='coupon', grid=True, style='-*', title='US Treasury coupons by issue date (last 4 years)', figsize=(12,8))

# describe
govt_symbology_4y[['start_date', 'coupon']].describe()
```

<div>
<style scoped>
	.dataframe tbody tr th:only-of-type {
		vertical-align: middle;
	}

    .dataframe tbody tr th {
        vertical-align: top;
    }

    .dataframe thead th {
        text-align: right;
    }
</style>
<table border="1" class="dataframe">
  <thead>
	<tr style="text-align: right;">
	  <th></th>
	  <th>start_date</th>
	  <th>coupon</th>
	</tr>
  </thead>
  <tbody>
	<tr>
	  <th>count</th>
	  <td>239</td>
	  <td>239.000000</td>
	</tr>
	<tr>
	  <th>mean</th>
	  <td>2022-04-11 07:37:54.476987392</td>
	  <td>2.366109</td>
	</tr>
	<tr>
	  <th>min</th>
	  <td>2020-04-15 00:00:00</td>
	  <td>0.125000</td>
	</tr>
	<tr>
	  <th>25%</th>
	  <td>2021-04-07 12:00:00</td>
	  <td>0.625000</td>
	</tr>
	<tr>
	  <th>50%</th>
	  <td>2022-04-18 00:00:00</td>
	  <td>2.500000</td>
	</tr>
	<tr>
	  <th>75%</th>
	  <td>2023-04-08 12:00:00</td>
	  <td>4.000000</td>
	</tr>
	<tr>
	  <th>max</th>
	  <td>2024-04-01 00:00:00</td>
	  <td>5.000000</td>
	</tr>
	<tr>
	  <th>std</th>
	  <td>NaN</td>
	  <td>1.663802</td>
	</tr>
  </tbody>
</table>
</div>

![png](output_10_1.png)

What can you say about the overall level of issued coupons in the last 4 years?

Based on the summary statistics provided, we can make following observations:

- The average (mean) coupon rate is 2.367.
- The median coupon rate (50th percentile) is 2.5
- The minimum coupon rate is 0.125, while the maximum is 5.00.
- The coupon rate increased from decade lows of 0.125 in 2020, to decade highs of 5.00 in 2023.

## c. Load the on-the-run US treasuries

Load the `govt_on_the_run` Excel file into a dataframe. Select the current on-the-run 2Y, 3Y, 5Y, 7Y, 10Y, 20Y and 30Y issues (off-the-run issues have the B & C suffix). Create a separate symbology dataframe for on-the-run treasuries only, to be used later on for the on-the-run government yield curve bootstrapping.

```python
# Load govt_on_the_run, as of 2024-04-01
govt_on_the_run = pd.read_excel('./data/govt_on_the_run.xlsx')

# Keep OTR treasuries only
govt_on_the_run_simple = govt_on_the_run[~govt_on_the_run['ticker'].str.contains('B|C')]
display(govt_on_the_run_simple)
```

<div>
<style scoped>
	.dataframe tbody tr th:only-of-type {
		vertical-align: middle;
	}

    .dataframe tbody tr th {
        vertical-align: top;
    }

    .dataframe thead th {
        text-align: right;
    }
</style>
<table border="1" class="dataframe">
  <thead>
	<tr style="text-align: right;">
	  <th></th>
	  <th>ticker</th>
	  <th>date</th>
	  <th>figi</th>
	  <th>isin</th>
	</tr>
  </thead>
  <tbody>
	<tr>
	  <th>0</th>
	  <td>GT10 Govt</td>
	  <td>2024-04-01</td>
	  <td>BBG01L8YJFB3</td>
	  <td>US91282CJZ59</td>
	</tr>
	<tr>
	  <th>3</th>
	  <td>GT2 Govt</td>
	  <td>2024-04-01</td>
	  <td>BBG01M44ZLG5</td>
	  <td>US91282CKH33</td>
	</tr>
	<tr>
	  <th>4</th>
	  <td>GT20 Govt</td>
	  <td>2024-04-01</td>
	  <td>BBG01LK8Y0L1</td>
	  <td>US912810TZ12</td>
	</tr>
	<tr>
	  <th>9</th>
	  <td>GT3 Govt</td>
	  <td>2024-04-01</td>
	  <td>BBG01LW4R927</td>
	  <td>US91282CKE02</td>
	</tr>
	<tr>
	  <th>10</th>
	  <td>GT30 Govt</td>
	  <td>2024-04-01</td>
	  <td>BBG01L8YJKX8</td>
	  <td>US912810TX63</td>
	</tr>
	<tr>
	  <th>15</th>
	  <td>GT5 Govt</td>
	  <td>2024-04-01</td>
	  <td>BBG01M44ZQJ1</td>
	  <td>US91282CKG59</td>
	</tr>
	<tr>
	  <th>18</th>
	  <td>GT7 Govt</td>
	  <td>2024-04-01</td>
	  <td>BBG01M44ZS07</td>
	  <td>US91282CKF76</td>
	</tr>
  </tbody>
</table>
</div>

```python
# Create symbology for on-the-run treasuries only
govt_symbology_otr = govt_symbology[govt_symbology['isin'].isin(govt_on_the_run_simple['isin'])]
govt_symbology_otr = govt_symbology_otr.sort_values(by='TTM')
display(govt_symbology_otr)
```

<div>
<style scoped>
	.dataframe tbody tr th:only-of-type {
		vertical-align: middle;
	}

    .dataframe tbody tr th {
        vertical-align: top;
    }

    .dataframe thead th {
        text-align: right;
    }
</style>
<table border="1" class="dataframe">
  <thead>
	<tr style="text-align: right;">
	  <th></th>
	  <th>ticker</th>
	  <th>class</th>
	  <th>figi</th>
	  <th>isin</th>
	  <th>und_bench_isin</th>
	  <th>security</th>
	  <th>name</th>
	  <th>type</th>
	  <th>coupon</th>
	  <th>cpn_type</th>
	  <th>…</th>
	  <th>acc_first</th>
	  <th>maturity</th>
	  <th>mty_typ</th>
	  <th>rank</th>
	  <th>amt_out</th>
	  <th>country</th>
	  <th>currency</th>
	  <th>status</th>
	  <th>term</th>
	  <th>TTM</th>
	</tr>
  </thead>
  <tbody>
	<tr>
	  <th>879</th>
	  <td>T</td>
	  <td>Govt</td>
	  <td>BBG01M44ZLG5</td>
	  <td>US91282CKH33</td>
	  <td>US91282CKH33</td>
	  <td>T 4 1/2 03/31/26</td>
	  <td>US TREASURY N/B</td>
	  <td>US GOVERNMENT</td>
	  <td>4.500</td>
	  <td>FIXED</td>
	  <td>…</td>
	  <td>2024-03-31</td>
	  <td>2026-03-31</td>
	  <td>NORMAL</td>
	  <td>Unsecured</td>
	  <td>66000.0</td>
	  <td>US</td>
	  <td>USD</td>
	  <td>ACTV</td>
	  <td>1.995893</td>
	  <td>1.995893</td>
	</tr>
	<tr>
	  <th>876</th>
	  <td>T</td>
	  <td>Govt</td>
	  <td>BBG01LW4R927</td>
	  <td>US91282CKE02</td>
	  <td>US91282CKE02</td>
	  <td>T 4 1/4 03/15/27</td>
	  <td>US TREASURY N/B</td>
	  <td>US GOVERNMENT</td>
	  <td>4.250</td>
	  <td>FIXED</td>
	  <td>…</td>
	  <td>2024-03-15</td>
	  <td>2027-03-15</td>
	  <td>NORMAL</td>
	  <td>Unsecured</td>
	  <td>56000.0</td>
	  <td>US</td>
	  <td>USD</td>
	  <td>ACTV</td>
	  <td>2.997947</td>
	  <td>2.951403</td>
	</tr>
	<tr>
	  <th>878</th>
	  <td>T</td>
	  <td>Govt</td>
	  <td>BBG01M44ZQJ1</td>
	  <td>US91282CKG59</td>
	  <td>US91282CKG59</td>
	  <td>T 4 1/8 03/31/29</td>
	  <td>US TREASURY N/B</td>
	  <td>US GOVERNMENT</td>
	  <td>4.125</td>
	  <td>FIXED</td>
	  <td>…</td>
	  <td>2024-03-31</td>
	  <td>2029-03-31</td>
	  <td>NORMAL</td>
	  <td>Unsecured</td>
	  <td>67000.0</td>
	  <td>US</td>
	  <td>USD</td>
	  <td>ACTV</td>
	  <td>4.996578</td>
	  <td>4.996578</td>
	</tr>
	<tr>
	  <th>877</th>
	  <td>T</td>
	  <td>Govt</td>
	  <td>BBG01M44ZS07</td>
	  <td>US91282CKF76</td>
	  <td>US91282CKF76</td>
	  <td>T 4 1/8 03/31/31</td>
	  <td>US TREASURY N/B</td>
	  <td>US GOVERNMENT</td>
	  <td>4.125</td>
	  <td>FIXED</td>
	  <td>…</td>
	  <td>2024-03-31</td>
	  <td>2031-03-31</td>
	  <td>NORMAL</td>
	  <td>Unsecured</td>
	  <td>43000.0</td>
	  <td>US</td>
	  <td>USD</td>
	  <td>ACTV</td>
	  <td>6.995209</td>
	  <td>6.995209</td>
	</tr>
	<tr>
	  <th>871</th>
	  <td>T</td>
	  <td>Govt</td>
	  <td>BBG01L8YJFB3</td>
	  <td>US91282CJZ59</td>
	  <td>US91282CJZ59</td>
	  <td>T 4 02/15/34</td>
	  <td>US TREASURY N/B</td>
	  <td>US GOVERNMENT</td>
	  <td>4.000</td>
	  <td>FIXED</td>
	  <td>…</td>
	  <td>2024-02-15</td>
	  <td>2034-02-15</td>
	  <td>NORMAL</td>
	  <td>Unsecured</td>
	  <td>84104.0</td>
	  <td>US</td>
	  <td>USD</td>
	  <td>ACTV</td>
	  <td>10.001369</td>
	  <td>9.875428</td>
	</tr>
	<tr>
	  <th>434</th>
	  <td>T</td>
	  <td>Govt</td>
	  <td>BBG01LK8Y0L1</td>
	  <td>US912810TZ12</td>
	  <td>US912810TZ12</td>
	  <td>T 4 1/2 02/15/44</td>
	  <td>US TREASURY N/B</td>
	  <td>US GOVERNMENT</td>
	  <td>4.500</td>
	  <td>FIXED</td>
	  <td>…</td>
	  <td>2024-02-15</td>
	  <td>2044-02-15</td>
	  <td>NORMAL</td>
	  <td>Unsecured</td>
	  <td>29684.0</td>
	  <td>US</td>
	  <td>USD</td>
	  <td>ACTV</td>
	  <td>19.961670</td>
	  <td>19.874059</td>
	</tr>
	<tr>
	  <th>433</th>
	  <td>T</td>
	  <td>Govt</td>
	  <td>BBG01L8YJKX8</td>
	  <td>US912810TX63</td>
	  <td>US912810TX63</td>
	  <td>T 4 1/4 02/15/54</td>
	  <td>US TREASURY N/B</td>
	  <td>US GOVERNMENT</td>
	  <td>4.250</td>
	  <td>FIXED</td>
	  <td>…</td>
	  <td>2024-02-15</td>
	  <td>2054-02-15</td>
	  <td>NORMAL</td>
	  <td>Unsecured</td>
	  <td>48846.0</td>
	  <td>US</td>
	  <td>USD</td>
	  <td>ACTV</td>
	  <td>30.001369</td>
	  <td>29.875428</td>
	</tr>
  </tbody>
</table>
<p>7 rows × 25 columns</p>
</div>

## d. Load and explore US corporate bonds symbology data

Starting from the `bond_symbology` dataframe, create a corporate bond dataframe containing

* bullet/non-callable (mty_typ="AT MATURITY"), 
* senior unsecured (rank = "Sr Unsecured"),
* fixed coupon (cpn_type="FIXED")

bonds only, with following columns:

| ticker | isin | figi | security | name | coupon | start_date | maturity | term | TTM |
|----------|-------|-------|-------------|-----|----------|---------|---------|---------|---------|

where 

* `term` refers to the initial term/time-to-maturity in years
* `TTM` refers to the current time-to-maturity in years

Create a separate dataframe for VZ issuer only (ticker = 'VZ') and display it.

```python
# Create Corp bonds symbology df
corp_symbology = bond_symbology[bond_symbology['class'] == 'Corp'].copy()

corp_symbology = corp_symbology[(corp_symbology['mty_typ'] == 'AT MATURITY') 
                                   & (corp_symbology['rank'] == 'Sr Unsecured')
                                   & (corp_symbology['cpn_type'] == 'FIXED')]

# Keep selected columns only
corp_symbology = corp_symbology[['ticker', 'isin', 'figi', 'security', 'name', 'coupon', 'start_date', 'maturity', 'term', 'TTM']]

# Filter for VZ issuer
corp_symbology_vz =  corp_symbology[corp_symbology['ticker'] == 'VZ']
corp_symbology_vz = corp_symbology_vz.sort_values(by='TTM')

# Display corp_symbology_vz
display(corp_symbology_vz)
```

<div>
<style scoped>
	.dataframe tbody tr th:only-of-type {
		vertical-align: middle;
	}

    .dataframe tbody tr th {
        vertical-align: top;
    }

    .dataframe thead th {
        text-align: right;
    }
</style>
<table border="1" class="dataframe">
  <thead>
	<tr style="text-align: right;">
	  <th></th>
	  <th>ticker</th>
	  <th>isin</th>
	  <th>figi</th>
	  <th>security</th>
	  <th>name</th>
	  <th>coupon</th>
	  <th>start_date</th>
	  <th>maturity</th>
	  <th>term</th>
	  <th>TTM</th>
	</tr>
  </thead>
  <tbody>
	<tr>
	  <th>893</th>
	  <td>VZ</td>
	  <td>US92343VDD38</td>
	  <td>BBG00DGYP877</td>
	  <td>VZ 2 5/8 08/15/26</td>
	  <td>VERIZON COMMUNICATIONS</td>
	  <td>2.625</td>
	  <td>2016-08-01</td>
	  <td>2026-08-15</td>
	  <td>10.036961</td>
	  <td>2.370979</td>
	</tr>
	<tr>
	  <th>898</th>
	  <td>VZ</td>
	  <td>US92343VDY74</td>
	  <td>BBG00G6QW2B8</td>
	  <td>VZ 4 1/8 03/16/27</td>
	  <td>VERIZON COMMUNICATIONS</td>
	  <td>4.125</td>
	  <td>2017-03-16</td>
	  <td>2027-03-16</td>
	  <td>9.998631</td>
	  <td>2.954141</td>
	</tr>
	<tr>
	  <th>900</th>
	  <td>VZ</td>
	  <td>US92343VER15</td>
	  <td>BBG00M1BQWX0</td>
	  <td>VZ 4.329 09/21/28</td>
	  <td>VERIZON COMMUNICATIONS</td>
	  <td>4.329</td>
	  <td>2018-10-22</td>
	  <td>2028-09-21</td>
	  <td>9.916496</td>
	  <td>4.473648</td>
	</tr>
	<tr>
	  <th>927</th>
	  <td>VZ</td>
	  <td>US92344GAM87</td>
	  <td>BBG00003TCX8</td>
	  <td>VZ 7 3/4 12/01/30</td>
	  <td>VERIZON COMMUNICATIONS</td>
	  <td>7.750</td>
	  <td>2001-09-07</td>
	  <td>2030-12-01</td>
	  <td>29.232033</td>
	  <td>6.666667</td>
	</tr>
	<tr>
	  <th>899</th>
	  <td>VZ</td>
	  <td>US92343VEA89</td>
	  <td>BBG00HC11V79</td>
	  <td>VZ 4 1/2 08/10/33</td>
	  <td>VERIZON COMMUNICATIONS</td>
	  <td>4.500</td>
	  <td>2017-08-10</td>
	  <td>2033-08-10</td>
	  <td>16.000000</td>
	  <td>9.357974</td>
	</tr>
	<tr>
	  <th>884</th>
	  <td>VZ</td>
	  <td>US92343VBS25</td>
	  <td>BBG00580D503</td>
	  <td>VZ 6.4 09/15/33</td>
	  <td>VERIZON COMMUNICATIONS</td>
	  <td>6.400</td>
	  <td>2013-09-18</td>
	  <td>2033-09-15</td>
	  <td>19.991786</td>
	  <td>9.456537</td>
	</tr>
	<tr>
	  <th>928</th>
	  <td>VZ</td>
	  <td>US92344GAX43</td>
	  <td>BBG0000BH8D4</td>
	  <td>VZ 5.85 09/15/35</td>
	  <td>VERIZON COMMUNICATIONS</td>
	  <td>5.850</td>
	  <td>2005-09-13</td>
	  <td>2035-09-15</td>
	  <td>30.004107</td>
	  <td>11.455168</td>
	</tr>
	<tr>
	  <th>889</th>
	  <td>VZ</td>
	  <td>US92343VCV45</td>
	  <td>BBG009PNV1G8</td>
	  <td>VZ 4.272 01/15/36</td>
	  <td>VERIZON COMMUNICATIONS</td>
	  <td>4.272</td>
	  <td>2015-08-20</td>
	  <td>2036-01-15</td>
	  <td>20.405202</td>
	  <td>11.789185</td>
	</tr>
	<tr>
	  <th>896</th>
	  <td>VZ</td>
	  <td>US92343VDU52</td>
	  <td>BBG00G6QW5Q5</td>
	  <td>VZ 5 1/4 03/16/37</td>
	  <td>VERIZON COMMUNICATIONS</td>
	  <td>5.250</td>
	  <td>2017-03-16</td>
	  <td>2037-03-16</td>
	  <td>20.000000</td>
	  <td>12.955510</td>
	</tr>
	<tr>
	  <th>880</th>
	  <td>VZ</td>
	  <td>US92343VAF13</td>
	  <td>BBG00000BHR9</td>
	  <td>VZ 6 1/4 04/01/37</td>
	  <td>VERIZON COMMUNICATIONS</td>
	  <td>6.250</td>
	  <td>2007-04-03</td>
	  <td>2037-04-01</td>
	  <td>29.995893</td>
	  <td>12.999316</td>
	</tr>
	<tr>
	  <th>881</th>
	  <td>VZ</td>
	  <td>US92343VAK08</td>
	  <td>BBG0000M1DD6</td>
	  <td>VZ 6.4 02/15/38</td>
	  <td>VERIZON COMMUNICATIONS</td>
	  <td>6.400</td>
	  <td>2008-02-12</td>
	  <td>2038-02-15</td>
	  <td>30.009582</td>
	  <td>13.875428</td>
	</tr>
	<tr>
	  <th>894</th>
	  <td>VZ</td>
	  <td>US92343VDR24</td>
	  <td>BBG00GX2G1Z5</td>
	  <td>VZ 4.812 03/15/39</td>
	  <td>VERIZON COMMUNICATIONS</td>
	  <td>4.812</td>
	  <td>2017-07-06</td>
	  <td>2039-03-15</td>
	  <td>21.689254</td>
	  <td>14.951403</td>
	</tr>
	<tr>
	  <th>882</th>
	  <td>VZ</td>
	  <td>US92343VBE39</td>
	  <td>BBG0027BCJ08</td>
	  <td>VZ 4 3/4 11/01/41</td>
	  <td>VERIZON COMMUNICATIONS</td>
	  <td>4.750</td>
	  <td>2011-11-03</td>
	  <td>2041-11-01</td>
	  <td>29.995893</td>
	  <td>17.585216</td>
	</tr>
	<tr>
	  <th>885</th>
	  <td>VZ</td>
	  <td>US92343VBT08</td>
	  <td>BBG00580DD79</td>
	  <td>VZ 6.55 09/15/43</td>
	  <td>VERIZON COMMUNICATIONS</td>
	  <td>6.550</td>
	  <td>2013-09-18</td>
	  <td>2043-09-15</td>
	  <td>29.990418</td>
	  <td>19.455168</td>
	</tr>
	<tr>
	  <th>892</th>
	  <td>VZ</td>
	  <td>US92343VDC54</td>
	  <td>BBG00DGYPVQ5</td>
	  <td>VZ 4 1/8 08/15/46</td>
	  <td>VERIZON COMMUNICATIONS</td>
	  <td>4.125</td>
	  <td>2016-08-01</td>
	  <td>2046-08-15</td>
	  <td>30.036961</td>
	  <td>22.370979</td>
	</tr>
	<tr>
	  <th>886</th>
	  <td>VZ</td>
	  <td>US92343VCK89</td>
	  <td>BBG0083CP3G1</td>
	  <td>VZ 4.862 08/21/46</td>
	  <td>VERIZON COMMUNICATIONS</td>
	  <td>4.862</td>
	  <td>2015-03-11</td>
	  <td>2046-08-21</td>
	  <td>31.446954</td>
	  <td>22.387406</td>
	</tr>
	<tr>
	  <th>897</th>
	  <td>VZ</td>
	  <td>US92343VDV36</td>
	  <td>BBG00G6QW816</td>
	  <td>VZ 5 1/2 03/16/47</td>
	  <td>VERIZON COMMUNICATIONS</td>
	  <td>5.500</td>
	  <td>2017-03-16</td>
	  <td>2047-03-16</td>
	  <td>29.998631</td>
	  <td>22.954141</td>
	</tr>
	<tr>
	  <th>890</th>
	  <td>VZ</td>
	  <td>US92343VCX01</td>
	  <td>BBG009PNW3Z2</td>
	  <td>VZ 4.522 09/15/48</td>
	  <td>VERIZON COMMUNICATIONS</td>
	  <td>4.522</td>
	  <td>2015-08-20</td>
	  <td>2048-09-15</td>
	  <td>33.073238</td>
	  <td>24.457221</td>
	</tr>
	<tr>
	  <th>895</th>
	  <td>VZ</td>
	  <td>US92343VDS07</td>
	  <td>BBG00GX2GTT1</td>
	  <td>VZ 5.012 04/15/49</td>
	  <td>VERIZON COMMUNICATIONS</td>
	  <td>5.012</td>
	  <td>2017-07-06</td>
	  <td>2049-04-15</td>
	  <td>31.775496</td>
	  <td>25.037645</td>
	</tr>
	<tr>
	  <th>887</th>
	  <td>VZ</td>
	  <td>US92343VCM46</td>
	  <td>BBG0083CP816</td>
	  <td>VZ 5.012 08/21/54</td>
	  <td>VERIZON COMMUNICATIONS</td>
	  <td>5.012</td>
	  <td>2015-03-11</td>
	  <td>2054-08-21</td>
	  <td>39.446954</td>
	  <td>30.387406</td>
	</tr>
	<tr>
	  <th>891</th>
	  <td>VZ</td>
	  <td>US92343VCZ58</td>
	  <td>BBG009PNW578</td>
	  <td>VZ 4.672 03/15/55</td>
	  <td>VERIZON COMMUNICATIONS</td>
	  <td>4.672</td>
	  <td>2015-08-20</td>
	  <td>2055-03-15</td>
	  <td>39.567420</td>
	  <td>30.951403</td>
	</tr>
  </tbody>
</table>
</div>

### Problem 2: Explore EOD market prices and yields

## a. Load and explore treasury market prices and yields

Load the `bond_market_prices_eod` Excel file into a dataframe. It provides market data for US treasuries and corporate bonds as of 2024-04-01.

Merge the treasuries symbology dataframe with the market data and add the following columns:

| date | bidPrice | askPrice | midPrice | bidYield | askYield | midYield | term | TTM |
|----------|-------|-------------|-----|----------|---------|---------|---------|---------|

Plot a graph/scatter plot of treasury mid yields by TTM.

```python
# Load bond_market_prices_eod
bond_market_prices_eod = pd.read_excel('./data/bond_market_prices_eod.xlsx')

bond_market_prices_eod['midPrice'] = 0.5*(bond_market_prices_eod['bidPrice'] + bond_market_prices_eod['askPrice'])
bond_market_prices_eod['midYield'] = 0.5*(bond_market_prices_eod['bidYield'] + bond_market_prices_eod['askYield'])

display(bond_market_prices_eod.head())

```

<div>
<style scoped>
	.dataframe tbody tr th:only-of-type {
		vertical-align: middle;
	}

    .dataframe tbody tr th {
        vertical-align: top;
    }

    .dataframe thead th {
        text-align: right;
    }
</style>
<table border="1" class="dataframe">
  <thead>
	<tr style="text-align: right;">
	  <th></th>
	  <th>date</th>
	  <th>class</th>
	  <th>ticker</th>
	  <th>isin</th>
	  <th>figi</th>
	  <th>bidPrice</th>
	  <th>askPrice</th>
	  <th>accrued</th>
	  <th>bidYield</th>
	  <th>askYield</th>
	  <th>midPrice</th>
	  <th>midYield</th>
	</tr>
  </thead>
  <tbody>
	<tr>
	  <th>0</th>
	  <td>2024-04-01</td>
	  <td>Corp</td>
	  <td>AAPL</td>
	  <td>US037833AL42</td>
	  <td>BBG004HST0K7</td>
	  <td>85.400</td>
	  <td>86.020</td>
	  <td>1.5930</td>
	  <td>5.051</td>
	  <td>4.994</td>
	  <td>85.7100</td>
	  <td>5.0225</td>
	</tr>
	<tr>
	  <th>1</th>
	  <td>2024-04-01</td>
	  <td>Corp</td>
	  <td>AAPL</td>
	  <td>US037833AT77</td>
	  <td>BBG006F8VWJ7</td>
	  <td>93.592</td>
	  <td>94.366</td>
	  <td>1.8170</td>
	  <td>4.957</td>
	  <td>4.893</td>
	  <td>93.9790</td>
	  <td>4.9250</td>
	</tr>
	<tr>
	  <th>2</th>
	  <td>2024-04-01</td>
	  <td>Corp</td>
	  <td>AAPL</td>
	  <td>US037833BA77</td>
	  <td>BBG0081TNL50</td>
	  <td>79.130</td>
	  <td>79.806</td>
	  <td>0.5180</td>
	  <td>5.085</td>
	  <td>5.023</td>
	  <td>79.4680</td>
	  <td>5.0540</td>
	</tr>
	<tr>
	  <th>3</th>
	  <td>2024-04-01</td>
	  <td>Corp</td>
	  <td>AAPL</td>
	  <td>US037833BH21</td>
	  <td>BBG008N1BQC1</td>
	  <td>90.860</td>
	  <td>91.557</td>
	  <td>1.7015</td>
	  <td>5.086</td>
	  <td>5.028</td>
	  <td>91.2085</td>
	  <td>5.0570</td>
	</tr>
	<tr>
	  <th>4</th>
	  <td>2024-04-01</td>
	  <td>Corp</td>
	  <td>AAPL</td>
	  <td>US037833BW97</td>
	  <td>BBG00C7QBCQ1</td>
	  <td>98.176</td>
	  <td>98.630</td>
	  <td>0.5000</td>
	  <td>4.702</td>
	  <td>4.651</td>
	  <td>98.4030</td>
	  <td>4.6765</td>
	</tr>
  </tbody>
</table>
</div>

```python
# Merge market data as of 2024-04-01 into treasury symbology
govt_agg = govt_symbology.merge(bond_market_prices_eod,  on=['class','ticker','figi','isin'])

govt_agg.head()

# Plot a graph/scatter plot of treasury mid yields by TTM
govt_agg.plot(x='TTM', y='midYield', grid=True, style='*', title='US Treasury Yields by TTM', figsize=(12,8))
```

    <Axes: title={'center': 'US Treasury Yields by TTM'}, xlabel='TTM'>




    

![png](output_20_1.png)

## b. Explore on-the-run treasuries only

Create a separate joint dataframe for on-the-run treasuries only.

Plot a graph/scatter plot of on-the-run treasury mid yields by TTM.

```python
# Merge market data as of 2024-04-01 into treasury OTR symbology
govt_agg_otr = govt_symbology_otr.merge(bond_market_prices_eod,  on=['class','ticker','figi','isin'])

# Plot a graph/scatter plot of treasury OTR mid yields by TTM
govt_agg_otr.plot(x='TTM', y='midYield', grid=True, style='*-', title='OTR US Treasury yields by TTM', figsize=(12,8))
```

    <Axes: title={'center': 'OTR US Treasury yields by TTM'}, xlabel='TTM'>




    

![png](output_22_1.png)

## c. Load and explore corporate bond market prices and yields

Merge the filtered corporate bonds symbology dataframe with the market data and add the following columns:

| date | bidPrice | askPrice | midPrice | bidYield | askYield | midYield | term | TTM |
|----------|-------|-------------|-----|----------|---------|---------|---------|---------|

List the unique tickers/issuers available in the dataframe.

```python
# Merge market data as of 2024-04-01 into corp symbology
corp_agg = corp_symbology.merge(bond_market_prices_eod,  on=['ticker','figi','isin'])

print(corp_symbology.shape)

display(corp_agg.head())
```

    (70, 10)

<div>
<style scoped>
	.dataframe tbody tr th:only-of-type {
		vertical-align: middle;
	}

    .dataframe tbody tr th {
        vertical-align: top;
    }

    .dataframe thead th {
        text-align: right;
    }
</style>
<table border="1" class="dataframe">
  <thead>
	<tr style="text-align: right;">
	  <th></th>
	  <th>ticker</th>
	  <th>isin</th>
	  <th>figi</th>
	  <th>security</th>
	  <th>name</th>
	  <th>coupon</th>
	  <th>start_date</th>
	  <th>maturity</th>
	  <th>term</th>
	  <th>TTM</th>
	  <th>date</th>
	  <th>class</th>
	  <th>bidPrice</th>
	  <th>askPrice</th>
	  <th>accrued</th>
	  <th>bidYield</th>
	  <th>askYield</th>
	  <th>midPrice</th>
	  <th>midYield</th>
	</tr>
  </thead>
  <tbody>
	<tr>
	  <th>0</th>
	  <td>AAPL</td>
	  <td>US037833AL42</td>
	  <td>BBG004HST0K7</td>
	  <td>AAPL 3.85 05/04/43</td>
	  <td>APPLE INC</td>
	  <td>3.850</td>
	  <td>2013-05-03</td>
	  <td>2043-05-04</td>
	  <td>30.001369</td>
	  <td>19.088296</td>
	  <td>2024-04-01</td>
	  <td>Corp</td>
	  <td>85.400</td>
	  <td>86.020</td>
	  <td>1.5930</td>
	  <td>5.051</td>
	  <td>4.994</td>
	  <td>85.7100</td>
	  <td>5.0225</td>
	</tr>
	<tr>
	  <th>1</th>
	  <td>AAPL</td>
	  <td>US037833AT77</td>
	  <td>BBG006F8VWJ7</td>
	  <td>AAPL 4.45 05/06/44</td>
	  <td>APPLE INC</td>
	  <td>4.450</td>
	  <td>2014-05-06</td>
	  <td>2044-05-06</td>
	  <td>30.001369</td>
	  <td>20.095825</td>
	  <td>2024-04-01</td>
	  <td>Corp</td>
	  <td>93.592</td>
	  <td>94.366</td>
	  <td>1.8170</td>
	  <td>4.957</td>
	  <td>4.893</td>
	  <td>93.9790</td>
	  <td>4.9250</td>
	</tr>
	<tr>
	  <th>2</th>
	  <td>AAPL</td>
	  <td>US037833BA77</td>
	  <td>BBG0081TNL50</td>
	  <td>AAPL 3.45 02/09/45</td>
	  <td>APPLE INC</td>
	  <td>3.450</td>
	  <td>2015-02-09</td>
	  <td>2045-02-09</td>
	  <td>30.001369</td>
	  <td>20.859685</td>
	  <td>2024-04-01</td>
	  <td>Corp</td>
	  <td>79.130</td>
	  <td>79.806</td>
	  <td>0.5180</td>
	  <td>5.085</td>
	  <td>5.023</td>
	  <td>79.4680</td>
	  <td>5.0540</td>
	</tr>
	<tr>
	  <th>3</th>
	  <td>AAPL</td>
	  <td>US037833BH21</td>
	  <td>BBG008N1BQC1</td>
	  <td>AAPL 4 3/8 05/13/45</td>
	  <td>APPLE INC</td>
	  <td>4.375</td>
	  <td>2015-05-13</td>
	  <td>2045-05-13</td>
	  <td>30.001369</td>
	  <td>21.114305</td>
	  <td>2024-04-01</td>
	  <td>Corp</td>
	  <td>90.860</td>
	  <td>91.557</td>
	  <td>1.7015</td>
	  <td>5.086</td>
	  <td>5.028</td>
	  <td>91.2085</td>
	  <td>5.0570</td>
	</tr>
	<tr>
	  <th>4</th>
	  <td>DIS</td>
	  <td>US254687DV52</td>
	  <td>BBG00QNKP8R8</td>
	  <td>DIS 6.55 03/15/33</td>
	  <td>WALT DISNEY COMPANY/THE</td>
	  <td>6.550</td>
	  <td>2019-11-22</td>
	  <td>2033-03-15</td>
	  <td>13.311431</td>
	  <td>8.952772</td>
	  <td>2024-04-01</td>
	  <td>Corp</td>
	  <td>111.342</td>
	  <td>112.015</td>
	  <td>0.3285</td>
	  <td>4.965</td>
	  <td>4.877</td>
	  <td>111.6785</td>
	  <td>4.9210</td>
	</tr>
  </tbody>
</table>
</div>

```python
# Unique tickers
corp_agg_unique_tickers = corp_agg[['ticker', 'name']].drop_duplicates()

display(corp_agg_unique_tickers)
```

<div>
<style scoped>
	.dataframe tbody tr th:only-of-type {
		vertical-align: middle;
	}

    .dataframe tbody tr th {
        vertical-align: top;
    }

    .dataframe thead th {
        text-align: right;
    }
</style>
<table border="1" class="dataframe">
  <thead>
	<tr style="text-align: right;">
	  <th></th>
	  <th>ticker</th>
	  <th>name</th>
	</tr>
  </thead>
  <tbody>
	<tr>
	  <th>0</th>
	  <td>AAPL</td>
	  <td>APPLE INC</td>
	</tr>
	<tr>
	  <th>4</th>
	  <td>DIS</td>
	  <td>WALT DISNEY COMPANY/THE</td>
	</tr>
	<tr>
	  <th>17</th>
	  <td>F</td>
	  <td>FORD MOTOR CREDIT CO LLC</td>
	</tr>
	<tr>
	  <th>18</th>
	  <td>GM</td>
	  <td>GENERAL MOTORS FINL CO</td>
	</tr>
	<tr>
	  <th>20</th>
	  <td>IBM</td>
	  <td>IBM CORP</td>
	</tr>
	<tr>
	  <th>33</th>
	  <td>MS</td>
	  <td>MORGAN STANLEY</td>
	</tr>
	<tr>
	  <th>42</th>
	  <td>ORCL</td>
	  <td>ORACLE CORP</td>
	</tr>
	<tr>
	  <th>45</th>
	  <td>VZ</td>
	  <td>VERIZON COMMUNICATIONS</td>
	</tr>
  </tbody>
</table>
</div>

## d. Yield curve plots

Plot a graph/scatter plot of mid yield curves by TTM (one line per ticker/issuer).

Add a separate line for on-the-run US treasury yield curve (risk free curve).

What can you say about the credit issuer yields, compared to US treasury yields?

```python
# Plot a graph/scatter plot of ticker yields by TTM
plt.figure(figsize=(12,8))
plt.grid()
sns.lineplot(data=corp_agg, x='TTM', y='midYield', hue='ticker', marker='o').set_title('Corporate Bond Yields by TTM')
# sns.scatterplot(data=corp_agg[corp_agg['TTM'] <= 30], x='TTM', y='midYield', hue='ticker').set_title('Corporate Bond Yields by TTM')
sns.lineplot(data=govt_agg_otr, x='TTM', y='midYield', label='US Treasury', marker = 'o')

```

    <Axes: title={'center': 'Corporate Bond Yields by TTM'}, xlabel='TTM', ylabel='midYield'>




    

![png](output_27_1.png)

## Problem 3: Underlying treasury benchmarks and credit spreads

## a. Add underlying benchmark bond mid yields

Start with the corporate bond symbology dataframe. Use the column 'und_bench_yield' to identify the underlying benchmark bond for each bond issue.

Add two new columns to the joint corporate bond dataframe:

| und_bench_yield | credit_spread |
|----------|-------|

where 

* `und_bench_yield` = underlying benchmark bond mid yield and
* `credit_spread` = issue yield - underlying benchmark bond mid yield.

```python
# Use the column 'und_bench_yield' to identify the underlying benchmark bond for each bond issue.
corp_merged = corp_agg.merge(bond_symbology[['isin', 'und_bench_isin']], on='isin')

# Create df containing govt_benchmark_yields
govt_benchmark_yields = bond_market_prices_eod[bond_market_prices_eod['class'] == 'Govt'][['isin', 'midYield']]
govt_benchmark_yields.rename(columns={'midYield': 'und_bench_yield', 'isin': 'und_bench_isin'}, inplace=True)

# Add benchmark bond yield
corp_merged = corp_merged.merge(govt_benchmark_yields, on='und_bench_isin')
corp_merged['credit_spread'] = corp_merged['midYield'] - corp_merged['und_bench_yield']
display(corp_merged[['ticker', 'isin', 'figi', 'security', 'und_bench_isin', 'midYield', 'und_bench_yield', 'credit_spread']])


```

<div>
<style scoped>
	.dataframe tbody tr th:only-of-type {
		vertical-align: middle;
	}

    .dataframe tbody tr th {
        vertical-align: top;
    }

    .dataframe thead th {
        text-align: right;
    }
</style>
<table border="1" class="dataframe">
  <thead>
	<tr style="text-align: right;">
	  <th></th>
	  <th>ticker</th>
	  <th>isin</th>
	  <th>figi</th>
	  <th>security</th>
	  <th>und_bench_isin</th>
	  <th>midYield</th>
	  <th>und_bench_yield</th>
	  <th>credit_spread</th>
	</tr>
  </thead>
  <tbody>
	<tr>
	  <th>0</th>
	  <td>AAPL</td>
	  <td>US037833AL42</td>
	  <td>BBG004HST0K7</td>
	  <td>AAPL 3.85 05/04/43</td>
	  <td>US912810TZ12</td>
	  <td>5.0225</td>
	  <td>4.5545</td>
	  <td>0.4680</td>
	</tr>
	<tr>
	  <th>1</th>
	  <td>AAPL</td>
	  <td>US037833AT77</td>
	  <td>BBG006F8VWJ7</td>
	  <td>AAPL 4.45 05/06/44</td>
	  <td>US912810TZ12</td>
	  <td>4.9250</td>
	  <td>4.5545</td>
	  <td>0.3705</td>
	</tr>
	<tr>
	  <th>2</th>
	  <td>AAPL</td>
	  <td>US037833BA77</td>
	  <td>BBG0081TNL50</td>
	  <td>AAPL 3.45 02/09/45</td>
	  <td>US912810TZ12</td>
	  <td>5.0540</td>
	  <td>4.5545</td>
	  <td>0.4995</td>
	</tr>
	<tr>
	  <th>3</th>
	  <td>AAPL</td>
	  <td>US037833BH21</td>
	  <td>BBG008N1BQC1</td>
	  <td>AAPL 4 3/8 05/13/45</td>
	  <td>US912810TZ12</td>
	  <td>5.0570</td>
	  <td>4.5545</td>
	  <td>0.5025</td>
	</tr>
	<tr>
	  <th>4</th>
	  <td>DIS</td>
	  <td>US254687ER32</td>
	  <td>BBG00QNKVGW7</td>
	  <td>DIS 6.15 02/15/41</td>
	  <td>US912810TZ12</td>
	  <td>5.3310</td>
	  <td>4.5545</td>
	  <td>0.7765</td>
	</tr>
	<tr>
	  <th>…</th>
	  <td>…</td>
	  <td>…</td>
	  <td>…</td>
	  <td>…</td>
	  <td>…</td>
	  <td>…</td>
	  <td>…</td>
	  <td>…</td>
	</tr>
	<tr>
	  <th>65</th>
	  <td>VZ</td>
	  <td>US92343VCX01</td>
	  <td>BBG009PNW3Z2</td>
	  <td>VZ 4.522 09/15/48</td>
	  <td>US912810TV08</td>
	  <td>5.4405</td>
	  <td>4.4445</td>
	  <td>0.9960</td>
	</tr>
	<tr>
	  <th>66</th>
	  <td>VZ</td>
	  <td>US92343VCZ58</td>
	  <td>BBG009PNW578</td>
	  <td>VZ 4.672 03/15/55</td>
	  <td>US912810TV08</td>
	  <td>5.4095</td>
	  <td>4.4445</td>
	  <td>0.9650</td>
	</tr>
	<tr>
	  <th>67</th>
	  <td>VZ</td>
	  <td>US92343VDS07</td>
	  <td>BBG00GX2GTT1</td>
	  <td>VZ 5.012 04/15/49</td>
	  <td>US912810TV08</td>
	  <td>5.1910</td>
	  <td>4.4445</td>
	  <td>0.7465</td>
	</tr>
	<tr>
	  <th>68</th>
	  <td>DIS</td>
	  <td>USU25497BM60</td>
	  <td>BBG00N55NLL7</td>
	  <td>DIS 7.9 12/01/2095</td>
	  <td>US912810TV08</td>
	  <td>5.9910</td>
	  <td>4.4445</td>
	  <td>1.5465</td>
	</tr>
	<tr>
	  <th>69</th>
	  <td>DIS</td>
	  <td>USU25497BN44</td>
	  <td>BBG00N55NPV7</td>
	  <td>DIS 8 1/4 10/17/2096</td>
	  <td>US912810TV08</td>
	  <td>6.0480</td>
	  <td>4.4445</td>
	  <td>1.6035</td>
	</tr>
  </tbody>
</table>
<p>70 rows × 8 columns</p>
</div>

## b. Credit spread curve plots

Plot a graph/scatter plot of credit spread curves by TTM (one line per issuer).

```python
# Plot a graph/scatter plot of credit spreads by TTM
plt.figure(figsize=(12,8))
plt.grid()
sns.lineplot(data=corp_merged, x='TTM', y='credit_spread', hue='ticker', marker='o').set_title('Corporate Bond Credit Spreads by TTM')

```

    Text(0.5, 1.0, 'Corporate Bond Credit Spreads by TTM')




    

![png](output_32_1.png)

## c. Add g-spreads

Add two new columns to the joint corporate bond dataframe:

| interp_tsy_yield | g_spread |
|----------|-------|

where 

* `interp_tsy_yield` = interpolated treasury yield (using on-the-run treasuries only), matching the issue maturity
* `g_spread` = issue yield - interp_tsy_yield.

```python
# Interpolate OTR Treasury yields on corporate bond TTMs
interp_tsy_yield_vec = np.interp(corp_merged['TTM'], govt_agg_otr['TTM'], govt_agg_otr['midYield'])

# Add interp_tsy_yield and g_spread
corp_merged['interp_tsy_yield'] = interp_tsy_yield_vec
corp_merged['g_spread'] = corp_merged['midYield'] - corp_merged['interp_tsy_yield']

# Display results
display(corp_merged[['ticker', 'isin', 'figi', 'security', 'und_bench_isin', 'midYield', 'und_bench_yield', 'credit_spread', 'interp_tsy_yield', 'g_spread']])
```

<div>
<style scoped>
	.dataframe tbody tr th:only-of-type {
		vertical-align: middle;
	}

    .dataframe tbody tr th {
        vertical-align: top;
    }

    .dataframe thead th {
        text-align: right;
    }
</style>
<table border="1" class="dataframe">
  <thead>
	<tr style="text-align: right;">
	  <th></th>
	  <th>ticker</th>
	  <th>isin</th>
	  <th>figi</th>
	  <th>security</th>
	  <th>und_bench_isin</th>
	  <th>midYield</th>
	  <th>und_bench_yield</th>
	  <th>credit_spread</th>
	  <th>interp_tsy_yield</th>
	  <th>g_spread</th>
	</tr>
  </thead>
  <tbody>
	<tr>
	  <th>0</th>
	  <td>AAPL</td>
	  <td>US037833AL42</td>
	  <td>BBG004HST0K7</td>
	  <td>AAPL 3.85 05/04/43</td>
	  <td>US912810TZ12</td>
	  <td>5.0225</td>
	  <td>4.5545</td>
	  <td>0.4680</td>
	  <td>4.535364</td>
	  <td>0.487136</td>
	</tr>
	<tr>
	  <th>1</th>
	  <td>AAPL</td>
	  <td>US037833AT77</td>
	  <td>BBG006F8VWJ7</td>
	  <td>AAPL 4.45 05/06/44</td>
	  <td>US912810TZ12</td>
	  <td>4.9250</td>
	  <td>4.5545</td>
	  <td>0.3705</td>
	  <td>4.552150</td>
	  <td>0.372850</td>
	</tr>
	<tr>
	  <th>2</th>
	  <td>AAPL</td>
	  <td>US037833BA77</td>
	  <td>BBG0081TNL50</td>
	  <td>AAPL 3.45 02/09/45</td>
	  <td>US912810TZ12</td>
	  <td>5.0540</td>
	  <td>4.5545</td>
	  <td>0.4995</td>
	  <td>4.544054</td>
	  <td>0.509946</td>
	</tr>
	<tr>
	  <th>3</th>
	  <td>AAPL</td>
	  <td>US037833BH21</td>
	  <td>BBG008N1BQC1</td>
	  <td>AAPL 4 3/8 05/13/45</td>
	  <td>US912810TZ12</td>
	  <td>5.0570</td>
	  <td>4.5545</td>
	  <td>0.5025</td>
	  <td>4.541355</td>
	  <td>0.515645</td>
	</tr>
	<tr>
	  <th>4</th>
	  <td>DIS</td>
	  <td>US254687ER32</td>
	  <td>BBG00QNKVGW7</td>
	  <td>DIS 6.15 02/15/41</td>
	  <td>US912810TZ12</td>
	  <td>5.3310</td>
	  <td>4.5545</td>
	  <td>0.7765</td>
	  <td>4.481490</td>
	  <td>0.849510</td>
	</tr>
	<tr>
	  <th>…</th>
	  <td>…</td>
	  <td>…</td>
	  <td>…</td>
	  <td>…</td>
	  <td>…</td>
	  <td>…</td>
	  <td>…</td>
	  <td>…</td>
	  <td>…</td>
	  <td>…</td>
	</tr>
	<tr>
	  <th>65</th>
	  <td>VZ</td>
	  <td>US92343VCX01</td>
	  <td>BBG009PNW3Z2</td>
	  <td>VZ 4.522 09/15/48</td>
	  <td>US912810TV08</td>
	  <td>5.4405</td>
	  <td>4.4445</td>
	  <td>0.9960</td>
	  <td>4.505925</td>
	  <td>0.934575</td>
	</tr>
	<tr>
	  <th>66</th>
	  <td>VZ</td>
	  <td>US92343VCZ58</td>
	  <td>BBG009PNW578</td>
	  <td>VZ 4.672 03/15/55</td>
	  <td>US912810TV08</td>
	  <td>5.4095</td>
	  <td>4.4445</td>
	  <td>0.9650</td>
	  <td>4.448500</td>
	  <td>0.961000</td>
	</tr>
	<tr>
	  <th>67</th>
	  <td>VZ</td>
	  <td>US92343VDS07</td>
	  <td>BBG00GX2GTT1</td>
	  <td>VZ 5.012 04/15/49</td>
	  <td>US912810TV08</td>
	  <td>5.1910</td>
	  <td>4.4445</td>
	  <td>0.7465</td>
	  <td>4.499773</td>
	  <td>0.691227</td>
	</tr>
	<tr>
	  <th>68</th>
	  <td>DIS</td>
	  <td>USU25497BM60</td>
	  <td>BBG00N55NLL7</td>
	  <td>DIS 7.9 12/01/2095</td>
	  <td>US912810TV08</td>
	  <td>5.9910</td>
	  <td>4.4445</td>
	  <td>1.5465</td>
	  <td>4.448500</td>
	  <td>1.542500</td>
	</tr>
	<tr>
	  <th>69</th>
	  <td>DIS</td>
	  <td>USU25497BN44</td>
	  <td>BBG00N55NPV7</td>
	  <td>DIS 8 1/4 10/17/2096</td>
	  <td>US912810TV08</td>
	  <td>6.0480</td>
	  <td>4.4445</td>
	  <td>1.6035</td>
	  <td>4.448500</td>
	  <td>1.599500</td>
	</tr>
  </tbody>
</table>
<p>70 rows × 10 columns</p>
</div>

## d. G-spread curve plots

Plot a graph/scatter plot of g-spread curves by TTM (one line per issuer).

```python
# Plot a graph/scatter plot of g-spreads by TTM
plt.figure(figsize=(12,8))
plt.grid()
sns.lineplot(data=corp_merged, x='TTM', y='g_spread', hue='ticker', marker='o').set_title('Corporate Bond G-Spreads by TTM')
```

    Text(0.5, 1.0, 'Corporate Bond G-Spreads by TTM')




    

![png](output_36_1.png)

## Problem 4: Explore sections 1 to 5 in the QuantLib example notebook

Explore sections 1 to 5 in the example notebook and identify concepts discussed in the first lecture. Collect open questions for the upcoming TA Review session on the analytics library.

Find the 'ORCL 2.95 04/01/30' bond (mentioned on page 12 in Session 1) in the bond symbology file. Create the corresponding fixed rate bond object and display the future cashflows. Do you match the cashflows displayed on page 13?

Going forward, we will be using QuantLib for curve calibration (US Treasury + SOFR), as well as pricing and risk of various cash and synthetic credit instruments.

```python
# Find the 'ORCL 2.95 04/01/30' bond in bond symbology
corp_symbology_orcl = bond_symbology[bond_symbology['security'] == 'ORCL 2.95 04/01/30']

display(corp_symbology_orcl.transpose())
```

<div>
<style scoped>
	.dataframe tbody tr th:only-of-type {
		vertical-align: middle;
	}

    .dataframe tbody tr th {
        vertical-align: top;
    }

    .dataframe thead th {
        text-align: right;
    }
</style>
<table border="1" class="dataframe">
  <thead>
	<tr style="text-align: right;">
	  <th></th>
	  <th>312</th>
	</tr>
  </thead>
  <tbody>
	<tr>
	  <th>ticker</th>
	  <td>ORCL</td>
	</tr>
	<tr>
	  <th>class</th>
	  <td>Corp</td>
	</tr>
	<tr>
	  <th>figi</th>
	  <td>BBG00SXGDGF0</td>
	</tr>
	<tr>
	  <th>isin</th>
	  <td>US68389XBV64</td>
	</tr>
	<tr>
	  <th>und_bench_isin</th>
	  <td>US91282CKG59</td>
	</tr>
	<tr>
	  <th>security</th>
	  <td>ORCL 2.95 04/01/30</td>
	</tr>
	<tr>
	  <th>name</th>
	  <td>ORACLE CORP</td>
	</tr>
	<tr>
	  <th>type</th>
	  <td>GLOBAL</td>
	</tr>
	<tr>
	  <th>coupon</th>
	  <td>2.95</td>
	</tr>
	<tr>
	  <th>cpn_type</th>
	  <td>FIXED</td>
	</tr>
	<tr>
	  <th>dcc</th>
	  <td>30/360</td>
	</tr>
	<tr>
	  <th>cpn_freq</th>
	  <td>2</td>
	</tr>
	<tr>
	  <th>days_settle</th>
	  <td>2</td>
	</tr>
	<tr>
	  <th>start_date</th>
	  <td>2020-04-01 00:00:00</td>
	</tr>
	<tr>
	  <th>cpn_first</th>
	  <td>2020-10-01 00:00:00</td>
	</tr>
	<tr>
	  <th>acc_first</th>
	  <td>2020-04-01 00:00:00</td>
	</tr>
	<tr>
	  <th>maturity</th>
	  <td>2030-04-01 00:00:00</td>
	</tr>
	<tr>
	  <th>mty_typ</th>
	  <td>CALLABLE</td>
	</tr>
	<tr>
	  <th>rank</th>
	  <td>Sr Unsecured</td>
	</tr>
	<tr>
	  <th>amt_out</th>
	  <td>3250.0</td>
	</tr>
	<tr>
	  <th>country</th>
	  <td>US</td>
	</tr>
	<tr>
	  <th>currency</th>
	  <td>USD</td>
	</tr>
	<tr>
	  <th>status</th>
	  <td>ACTV</td>
	</tr>
	<tr>
	  <th>term</th>
	  <td>9.998631</td>
	</tr>
	<tr>
	  <th>TTM</th>
	  <td>5.998631</td>
	</tr>
  </tbody>
</table>
</div>

```python
# Construct fixed rate cashflow schedule for ORCL 2.95 04/01/30

issue_date = ql.Date(1, 4, 2020)        # 2020-04-01
maturity_date = ql.Date(1, 4, 2030)     # 2030-04-01

coupon_freq = ql.Semiannual
coupon_term = ql.Period(coupon_freq)
calendar = ql.UnitedStates(ql.UnitedStates.GovernmentBond)
day_count_conv = ql.Unadjusted
date_generation = ql.DateGeneration.Backward
month_end = True

# fixed_rate_schedule
fixed_rate_schedule = ql.Schedule(issue_date,
                       maturity_date,
                       coupon_term,
                       calendar,
                       day_count_conv,
                       day_count_conv,
                       date_generation,
                       month_end)
```

```python
# Construct corporate bond object for ORCL 2.95 04/01/30

# day_count: 30/360 for fixed-rate Corp bonds
day_count = ql.Thirty360(ql.Thirty360.USA)

# settlement_days: 2 for Corp Bonds
settlement_days = 2

# coupons
coupon_rate = 0.295     # 2.95%
coupons = [coupon_rate]

# payment_convention
payment_convention = ql.Unadjusted

# face_value
face_value = 100


# Construct the fixed_rate_bond
face_value = 100
fixed_rate_bond = ql.FixedRateBond(
    settlement_days,
    face_value,
    fixed_rate_schedule,
    coupons,
    day_count,
    payment_convention)
```

```python
# Display the contractual cashflows. 
x = [(cf.date().to_date(), cf.amount()) for cf in fixed_rate_bond.cashflows()]
cf_date_fixed, cf_amount = zip(*x)
fixed_rate_bond_cashflows = pd.DataFrame(data={'CashFlowDate': cf_date_fixed, 'CashFlowAmount': cf_amount})

# Cashflows match the ones displayed on page 13 (from Bloomberg CSHF screenshot), up to the face value multiplier.
display(fixed_rate_bond_cashflows)
```

<div>
<style scoped>
	.dataframe tbody tr th:only-of-type {
		vertical-align: middle;
	}

    .dataframe tbody tr th {
        vertical-align: top;
    }

    .dataframe thead th {
        text-align: right;
    }
</style>
<table border="1" class="dataframe">
  <thead>
	<tr style="text-align: right;">
	  <th></th>
	  <th>CashFlowDate</th>
	  <th>CashFlowAmount</th>
	</tr>
  </thead>
  <tbody>
	<tr>
	  <th>0</th>
	  <td>2020-10-01</td>
	  <td>14.75</td>
	</tr>
	<tr>
	  <th>1</th>
	  <td>2021-04-01</td>
	  <td>14.75</td>
	</tr>
	<tr>
	  <th>2</th>
	  <td>2021-10-01</td>
	  <td>14.75</td>
	</tr>
	<tr>
	  <th>3</th>
	  <td>2022-04-01</td>
	  <td>14.75</td>
	</tr>
	<tr>
	  <th>4</th>
	  <td>2022-10-01</td>
	  <td>14.75</td>
	</tr>
	<tr>
	  <th>5</th>
	  <td>2023-04-01</td>
	  <td>14.75</td>
	</tr>
	<tr>
	  <th>6</th>
	  <td>2023-10-01</td>
	  <td>14.75</td>
	</tr>
	<tr>
	  <th>7</th>
	  <td>2024-04-01</td>
	  <td>14.75</td>
	</tr>
	<tr>
	  <th>8</th>
	  <td>2024-10-01</td>
	  <td>14.75</td>
	</tr>
	<tr>
	  <th>9</th>
	  <td>2025-04-01</td>
	  <td>14.75</td>
	</tr>
	<tr>
	  <th>10</th>
	  <td>2025-10-01</td>
	  <td>14.75</td>
	</tr>
	<tr>
	  <th>11</th>
	  <td>2026-04-01</td>
	  <td>14.75</td>
	</tr>
	<tr>
	  <th>12</th>
	  <td>2026-10-01</td>
	  <td>14.75</td>
	</tr>
	<tr>
	  <th>13</th>
	  <td>2027-04-01</td>
	  <td>14.75</td>
	</tr>
	<tr>
	  <th>14</th>
	  <td>2027-10-01</td>
	  <td>14.75</td>
	</tr>
	<tr>
	  <th>15</th>
	  <td>2028-04-01</td>
	  <td>14.75</td>
	</tr>
	<tr>
	  <th>16</th>
	  <td>2028-10-01</td>
	  <td>14.75</td>
	</tr>
	<tr>
	  <th>17</th>
	  <td>2029-04-01</td>
	  <td>14.75</td>
	</tr>
	<tr>
	  <th>18</th>
	  <td>2029-10-01</td>
	  <td>14.75</td>
	</tr>
	<tr>
	  <th>19</th>
	  <td>2030-04-01</td>
	  <td>14.75</td>
	</tr>
	<tr>
	  <th>20</th>
	  <td>2030-04-01</td>
	  <td>100.00</td>
	</tr>
  </tbody>
</table>
</div>

<hr><font color="green"><h1>from file: 2UChicago_FINM_35700_CreditMarkets_Spring2024_Examples_QuantLib_Basics</h1></font>

## Credit Markets
## FINM 35700 - Spring 2024

### UChicago Financial Mathematics

* Alex Popovici
* alex.popovici@uchicago.edu

## Basic Usage of QuantLib analytics library
## More details at: https://quantlib-python-docs.readthedocs.io/en/latest/

- 1\. Objects and Handles
  - a. Define a quote object and inspect the value
  - b. Define quoteHandle as a handle/smart pointer to the quote object    
  - c. Calendars and day-count conventions
- 2\. Cashflow Schedules
  - a. Construct semi-annual cashflow schedule object, for fixed-rate bonds
  - b. Inspect the semi-annual cashflow schedule
  - c. Construct quarterly cashflow schedule object, for floating-rate bonds
  - d. Inspect the quarterly cashflow schedule
- 3\. Discount Curve / Yield Curve Term Structure
  - a. Constructing a Flat Yield Curve
  - b. Inspect the discount curve
- 4\. Fixed and Floating Rate Bonds
  - a. Constructing a fixed rate bond object
  - b. Investigate the fixed-rate bond cash-flows
  - c. Constructing a floating rate bond object: linked to SOFR index
- 5\. Bond Present Value Calculation (no credit risk)
  - a. Direct function call using risk-free bond pricing engine
  - b. Manual Calculation to validate PV (for fixed and floating-rate bonds)
  - c. Bond Clean vs Dirty Prices (adjusted to settle date)
- 6\. Market Data Scenarios
  - a. Apply +/-1bp parallel shift scenarios in interest rates curve and compute scenario prices
  - b. Compute scenario DV01, duration and convexity
  - c. Yield to Price conversions
  - d. Price to Yield conversions
- 7\. Analytical Duration, Convexity and Z-Spread (flat yield model)
  - a. Compute bond duration, convexity and Z-Spread   
  - b. Validate Z-Spread
- 8\. Treasury Yield Curve Calibration (via Bootstrapping)
  - a. Calibrate treasury flat yield curve (simple case of one calibration instrument)
  - b. Display the calibrated Treasury discount curve dataframe
  - c. Plot the calibrated Treasury Zero Rates and Discount Factors curves
  - d. Reprice the bond on the yield curve to validate the calibration

```python
import QuantLib as ql
import numpy as np
import pandas as pd
```

# 1. Objects and Handles
## a. Define a quote object and inspect the value.

```python
quote = ql.SimpleQuote(.01)
print(quote.value())

quote.setValue(.02)
print(quote.value())
```

    0.01
    0.02

## b. Define quoteHandle as a handle/smart pointer to the quote object

```python
quoteHandle = ql.QuoteHandle(quote)
quoteHandle.value()
```

    0.02

### When the quote object is changed, the quoteHandle changes value as well

```python
quote.setValue(.03)
quoteHandle.value()
```

    0.03

## c. Calendars and day-count conventions

```python
# dates
todays_date = ql.Date.todaysDate()
test_date = todays_date + 90
print('todays_date =', todays_date)
print('test_date =', test_date)


# calendars
calendar = ql.UnitedStates(ql.UnitedStates.GovernmentBond)
holiday_list = list(calendar.holidayList(todays_date, test_date))
print('holiday_list =', holiday_list)


# day count conventions
day_count = ql.Actual360()
print('day_count =', day_count)

# year fractions
test_year_fraction = day_count.yearFraction(todays_date, test_date)
print('Year Fraction  from', todays_date, 'to', test_date,'] =', test_year_fraction)
```

    todays_date = March 17th, 2024
    test_date = June 15th, 2024
    holiday_list = [Date(29,3,2024), Date(27,5,2024)]
    day_count = Actual/360 day counter
    Year Fraction  from March 17th, 2024 to June 15th, 2024 ] = 0.25

# 2. Cashflow Schedules
## a. Construct semi-annual cashflow schedule object, for fixed-rate bonds

```python
issue_date = ql.Date(2, 4, 2024)        # 2024-04-02
maturity_date = ql.Date(2, 4, 2028)     # 2028-04-02
coupon_freq = ql.Semiannual
coupon_term = ql.Period(coupon_freq)
calendar = ql.UnitedStates(ql.UnitedStates.GovernmentBond)
day_count_conv = ql.Unadjusted
date_generation = ql.DateGeneration.Backward
month_end = True

# fixed_rate_schedule
fixed_rate_schedule = ql.Schedule(issue_date,
                       maturity_date,
                       coupon_term,
                       calendar,
                       day_count_conv,
                       day_count_conv,
                       date_generation,
                       month_end)
```

## b. Inspect the semi-annual cashflow schedule
- Use list() to get a list of all the dates in Schedule, and len() to get number of dates
- Use ] for random access
- use startDate(), endDate()

```python
print("All dates: ", list(fixed_rate_schedule))
print("Length: ", len(fixed_rate_schedule))
print("The 3rd coupon date: ", [fixed_rate_schedule])  # random access
print("Start Date: ", fixed_rate_schedule.startDate())
print("End Date: ", fixed_rate_schedule.endDate())
```

    All dates:  [Date(2,4,2024), Date(2,10,2024), Date(2,4,2025), Date(2,10,2025), Date(2,4,2026), Date(2,10,2026), Date(2,4,2027), Date(2,10,2027), Date(2,4,2028)]
    Length:  9
    The 3rd coupon date:  [<QuantLib.QuantLib.Schedule; proxy of <Swig Object of type 'Schedule *' at 0x0000023BD05A1BA0> >]
    Start Date:  April 2nd, 2024
    End Date:  April 2nd, 2028

## c. Construct quarterly cashflow schedule object, for floating-rate bonds

```python
# floating_rate_bond_schedule
floating_rate_schedule = ql.Schedule(
    issue_date,
    maturity_date,
    ql.Period(ql.Quarterly),
    calendar,
    day_count_conv,
    day_count_conv,
    date_generation,
    month_end,
)
```

## d. Inspect the quarterly cashflow schedule

```python
print("All dates: ", list(floating_rate_schedule))
print("Length: ", len(floating_rate_schedule))
print("Start Date: ", fixed_rate_schedule.startDate())
print("End Date: ", fixed_rate_schedule.endDate())
```

    All dates:  [Date(2,4,2024), Date(2,7,2024), Date(2,10,2024), Date(2,1,2025), Date(2,4,2025), Date(2,7,2025), Date(2,10,2025), Date(2,1,2026), Date(2,4,2026), Date(2,7,2026), Date(2,10,2026), Date(2,1,2027), Date(2,4,2027), Date(2,7,2027), Date(2,10,2027), Date(2,1,2028), Date(2,4,2028)]
    Length:  17
    Start Date:  April 2nd, 2024
    End Date:  April 2nd, 2028

# 3. Discount Curve / Yield Curve Term Structure
## a. Constructing a Flat Yield Curve

```python
# Set the static valuation date: 2024-04-02
calc_date = ql.Date(2, 4, 2024)
ql.Settings.instance().evaluationDate = calc_date

# using 5% flat interest rate for testing
flat_rate = ql.SimpleQuote(0.05)
rate_handle = ql.QuoteHandle(flat_rate)
day_count = ql.Actual360()
calendar = ql.UnitedStates(ql.UnitedStates.GovernmentBond)
continuous_comp = ql.Continuous # continously compounded rate of 5%
flat_yield_curve = ql.FlatForward(calc_date, rate_handle, day_count, continuous_comp)
flat_yield_curve_handle = ql.YieldTermStructureHandle(flat_yield_curve)
```

## b. Inspect the discount curve

```python
ref_date = flat_yield_curve.referenceDate()
test_date = ql.Date(30, 6, 2025)

# calc year fraction between ref_date and test_date
yearFrac = flat_yield_curve.dayCounter().yearFraction(ref_date, test_date)

print("Reference Date =", ref_date)
print("Test Date =", test_date)
print("Year Fraction between Reference Date and Test Date : ", yearFrac)
print("Discount Factor for Test Date", test_date, ": ", flat_yield_curve.discount(test_date))
print("custom DF calculation for Test Date", test_date, ": ", np.exp(-flat_rate.value() * yearFrac))
print("Difference in Discount Factor:", flat_yield_curve.discount(test_date) - np.exp(-flat_rate.value() * yearFrac))


```

    Reference Date = April 2nd, 2024
    Test Date = June 30th, 2025
    Year Fraction between Reference Date and Test Date :  1.261111111111111
    Discount Factor for Test Date June 30th, 2025 :  0.9388913116117773
    custom DF calculation for Test Date June 30th, 2025 :  0.9388913116117772
    Difference in Discount Factor: 1.1102230246251565e-16

# 4. Fixed and Floating Rate Bonds
## a. Constructing a fixed rate bond object

```python
# day_count: ACT/ACT for Govt bonds
day_count_govt = ql.ActualActual(ql.ActualActual.ISMA)

# day_count: 30/360 for fixed-rate Corp bonds
day_count_corp_fixed = ql.Thirty360(ql.Thirty360.USA)

# day_count: ACT/360 for floating-rate bonds
day_count_floater = ql.Actual360()


# settlement_days: 1 for Govt bonds
settlement_days_govt = 1

# settlement_days: 2 for Corp Bonds
settlement_days_corp = 2

# Govt Bonds specs
day_count = day_count_govt
settlement_days = settlement_days_govt

# coupons
coupon_rate = 0.04
coupons = [coupon_rate]

# payment_convention
payment_convention = ql.Unadjusted

# face_value
face_value = 100


# Construct the fixed_rate_bond
face_value = 100
fixed_rate_bond = ql.FixedRateBond(
    settlement_days,
    face_value,
    fixed_rate_schedule,
    coupons,
    day_count,
    payment_convention)
```

## b. Investigate the fixed-rate bond cash-flows

```python
x = [(cf.date(), cf.amount()) for cf in fixed_rate_bond.cashflows()]
cf_date_fixed, cf_amount = zip(*x)
cf_frame_fixed = pd.DataFrame(data={'CashFlowDate': cf_date_fixed, 'CashFlowAmount': cf_amount})
print(cf_frame_fixed)
```

            CashFlowDate  CashFlowAmount
    0  October 2nd, 2024             2.0
    1    April 2nd, 2025             2.0
    2  October 2nd, 2025             2.0
    3    April 2nd, 2026             2.0
    4  October 2nd, 2026             2.0
    5    April 2nd, 2027             2.0
    6  October 2nd, 2027             2.0
    7    April 2nd, 2028             2.0
    8    April 2nd, 2028           100.0

## c. Constructing a floating rate bond object: linked to SOFR index

```python
# sofr_term_structure_handle: using 5% flat interest rate for testing
rate_handle = ql.QuoteHandle(ql.SimpleQuote(5/100))
sofr_term_structure = ql.FlatForward(calc_date, rate_handle, day_count_floater, ql.Continuous)
sofr_term_structure_handle = ql.YieldTermStructureHandle(sofr_term_structure)

# Set SOFR index history
im = ql.IndexManager.instance()
sofr_index = ql.Sofr(sofr_term_structure_handle)

# Set SOFR fixings
im.clearHistory(sofr_index.name())
sofr_index.addFixing(ql.Date(28, ql.March, 2024), 5/100)
sofr_index.addFixing(ql.Date(1, ql.April, 2024), 5/100)


# floating_rate_bond
floating_rate_bond = ql.FloatingRateBond(settlement_days,
                                face_value,
                                floating_rate_schedule,
                                sofr_index,
                                day_count_floater,
                                payment_convention,
                                spreads=[25/10000], # 25 bps floating rate
                                issueDate=issue_date)

```

```python
x = [(cf.date(), cf.amount()) for cf in floating_rate_bond.cashflows()]
cf_date_float, cf_amount = zip(*x)
cf_frame_float = pd.DataFrame(data={'CashFlowDate': cf_date_float, 'CashFlowAmount': cf_amount})
print(cf_frame_float)
```

             CashFlowDate  CashFlowAmount
    0      July 2nd, 2024        1.335104
    1   October 2nd, 2024        1.349865
    2   January 2nd, 2025        1.349865
    3     April 2nd, 2025        1.320345
    4      July 2nd, 2025        1.335104
    5   October 2nd, 2025        1.349865
    6   January 2nd, 2026        1.349865
    7     April 2nd, 2026        1.320345
    8      July 2nd, 2026        1.335104
    9   October 2nd, 2026        1.349865
    10  January 2nd, 2027        1.350044
    11    April 2nd, 2027        1.320520
    12     July 2nd, 2027        1.335104
    13  October 2nd, 2027        1.350044
    14  January 2nd, 2028        1.350044
    15    April 2nd, 2028        1.335370
    16    April 2nd, 2028      100.000000

# 5. Bond Present Value Calculation (no credit risk)
## a. Direct function call using risk-free bond pricing engine

```python
# fixed_rate_bond PV
bond_engine = ql.DiscountingBondEngine(flat_yield_curve_handle)
fixed_rate_bond.setPricingEngine(bond_engine)
fixed_rate_bond_pv = fixed_rate_bond.NPV()
print('fixed_rate_bond_pv =', fixed_rate_bond_pv)

# floating_rate_bond PV
floating_rate_bond.setPricingEngine(bond_engine)
floating_rate_bond_pv = floating_rate_bond.NPV()
print('floating_rate_bond_pv =', floating_rate_bond_pv)
```

    fixed_rate_bond_pv = 95.93321956659715
    floating_rate_bond_pv = 100.91327849916414

## b. Manual Calculation to validate PV (for fixed and floating-rate bonds)

```python
# Validate fixed-rate bond PV
used_cf_frame = cf_frame_fixed
used_bond_pv = fixed_rate_bond_pv

# Validate floating-rate bond PV
discount_yearfrac = np.zeros((len(used_cf_frame,)))
discount_factor = np.zeros((len(used_cf_frame,)))

i = 0
for cf_date in used_cf_frame['CashFlowDate']:
    discount_yearfrac[i] = flat_yield_curve.dayCounter().yearFraction(flat_yield_curve.referenceDate(), cf_date)
    discount_factor[i] = flat_yield_curve.discount(cf_date)
    i += 1

used_cf_frame['YearFrac'] = discount_yearfrac
used_cf_frame['DiscountFactor'] = discount_factor
used_cf_frame['NPV'] = used_cf_frame['CashFlowAmount'] * used_cf_frame['DiscountFactor']

used_cf_frame
```

<div>
<style scoped>
	.dataframe tbody tr th:only-of-type {
		vertical-align: middle;
	}

    .dataframe tbody tr th {
        vertical-align: top;
    }

    .dataframe thead th {
        text-align: right;
    }
</style>
<table border="1" class="dataframe">
  <thead>
	<tr style="text-align: right;">
	  <th></th>
	  <th>CashFlowDate</th>
	  <th>CashFlowAmount</th>
	  <th>YearFrac</th>
	  <th>DiscountFactor</th>
	  <th>NPV</th>
	</tr>
  </thead>
  <tbody>
	<tr>
	  <th>0</th>
	  <td>October 2nd, 2024</td>
	  <td>2.0</td>
	  <td>0.508333</td>
	  <td>0.974904</td>
	  <td>1.949807</td>
	</tr>
	<tr>
	  <th>1</th>
	  <td>April 2nd, 2025</td>
	  <td>2.0</td>
	  <td>1.013889</td>
	  <td>0.950569</td>
	  <td>1.901138</td>
	</tr>
	<tr>
	  <th>2</th>
	  <td>October 2nd, 2025</td>
	  <td>2.0</td>
	  <td>1.522222</td>
	  <td>0.926713</td>
	  <td>1.853426</td>
	</tr>
	<tr>
	  <th>3</th>
	  <td>April 2nd, 2026</td>
	  <td>2.0</td>
	  <td>2.027778</td>
	  <td>0.903582</td>
	  <td>1.807163</td>
	</tr>
	<tr>
	  <th>4</th>
	  <td>October 2nd, 2026</td>
	  <td>2.0</td>
	  <td>2.536111</td>
	  <td>0.880905</td>
	  <td>1.761810</td>
	</tr>
	<tr>
	  <th>5</th>
	  <td>April 2nd, 2027</td>
	  <td>2.0</td>
	  <td>3.041667</td>
	  <td>0.858917</td>
	  <td>1.717833</td>
	</tr>
	<tr>
	  <th>6</th>
	  <td>October 2nd, 2027</td>
	  <td>2.0</td>
	  <td>3.550000</td>
	  <td>0.837361</td>
	  <td>1.674722</td>
	</tr>
	<tr>
	  <th>7</th>
	  <td>April 2nd, 2028</td>
	  <td>2.0</td>
	  <td>4.058333</td>
	  <td>0.816346</td>
	  <td>1.632693</td>
	</tr>
	<tr>
	  <th>8</th>
	  <td>April 2nd, 2028</td>
	  <td>100.0</td>
	  <td>4.058333</td>
	  <td>0.816346</td>
	  <td>81.634627</td>
	</tr>
  </tbody>
</table>
</div>

```python
pv_manual = used_cf_frame['NPV'].sum()
print('NPV engine = ', used_bond_pv)
print('NPV manual = ', pv_manual)
print('NPV diff = ', pv_manual - used_bond_pv)
```

    NPV engine =  95.93321956659715
    NPV manual =  95.93321956659715
    NPV diff =  0.0

## c. Bond Clean vs Dirty Prices (adjusted to settle date)

```python
print('Bond Notional = ', fixed_rate_bond.notional())
print('Settle Date = ', fixed_rate_bond.settlementDate())
print('Discount Factor to Settle Date = ', round(flat_yield_curve_handle.discount(fixed_rate_bond.settlementDate()), 4))
print('Bond NPV (Calc Date) = ', round(fixed_rate_bond.NPV(), 4))
print('Bond NPV Adjusted to Settle Date = ', round(fixed_rate_bond.NPV() / flat_yield_curve_handle.discount(fixed_rate_bond.settlementDate()), 4))
print('Bond Dirty Price = ', round(fixed_rate_bond.dirtyPrice(), 4))
print('Bond Clean Price = ', round(fixed_rate_bond.cleanPrice(), 4))
print('Bond Accrued = ', round(fixed_rate_bond.accruedAmount(), 4))

```

    Bond Notional =  100.0
    Settle Date =  April 3rd, 2024
    Discount Factor to Settle Date =  0.9999
    Bond NPV (Calc Date) =  95.9332
    Bond NPV Adjusted to Settle Date =  95.9465
    Bond Dirty Price =  95.9465
    Bond Clean Price =  95.9356
    Bond Accrued =  0.0109

# 6. Market Data Scenarios
## a. Apply +/-1bp parallel shift scenarios in interest rates curve and compute scenario prices

```python
# start with interest_rate_bump = 0
interest_rate_bump = ql.SimpleQuote(0.0)
flat_yield_curve_bumped = ql.ZeroSpreadedTermStructure(flat_yield_curve_handle, ql.QuoteHandle(interest_rate_bump))

bond_engine = ql.DiscountingBondEngine(ql.YieldTermStructureHandle(flat_yield_curve_bumped))
fixed_rate_bond.setPricingEngine(bond_engine)

price_base = fixed_rate_bond.cleanPrice()

# Original price (zero interest rate bump)
print("Price (base case): ", round(price_base, 4))

# Bump interest rate by +1bps (parallel shift)
interest_rate_bump.setValue(0.0001)
price_up_1bp = fixed_rate_bond.cleanPrice()
print("Price in +1bps scenario: ", round(price_up_1bp, 4))
print("Price diff in +1bps scenario: ", round(price_up_1bp - price_base, 6))

# Bump interest rate by -1bps (parallel shift)
interest_rate_bump.setValue(-0.0001)
price_down_1bp = fixed_rate_bond.cleanPrice()
print("Price for -1bps scenario:", round(price_down_1bp, 4))
print("Price diff in -1bps scenario: ", round(price_down_1bp - price_base, 6))

 # Remove interest rate bump
interest_rate_bump.setValue(0)


```

    Price (base case):  95.9356
    Price in +1bps scenario:  95.8993
    Price diff in +1bps scenario:  -0.036268
    Price for -1bps scenario: 95.9719
    Price diff in -1bps scenario:  0.036283

## b. Compute scenario DV01, duration and convexity

```python
# Compute scenario delta/gamma sensitivities
dv01 = round((price_down_1bp - price_base) * 1e4 / 100, 4)
duration = round(dv01 / fixed_rate_bond.dirtyPrice() * 100, 4)
gamma_1bp = (price_down_1bp - 2*price_base + price_up_1bp) * 1e8 / 100
convexity = round(gamma_1bp / fixed_rate_bond.dirtyPrice() * 100, 4)

print("DV01: ", dv01)
print("Duration: ", duration)
print("Convexity: ", convexity)



```

    DV01:  3.6283
    Duration:  3.7816
    Convexity:  14.9262

## c. Yield to Price conversions

```python
# Use original interest rate yield of 5%
# flat_rate.setValue(0.05)
print('Bond PV for', flat_rate.value()*100, 'pct yield:', round(fixed_rate_bond.NPV(), 4))


# Change interest rate yield to 6% and recompute bond PV
flat_rate.setValue(0.06)
print('Bond PV for', flat_rate.value()*100, 'pct yield:', round(fixed_rate_bond.NPV(), 4))

# Set interest rate yield back to 5%
flat_rate.setValue(0.05)
```

    Bond PV for 5.0 pct yield: 95.9332
    Bond PV for 6.0 pct yield: 92.3743

## d. Price to Yield conversions

```python
# bond_market_price = fixed_rate_bond.cleanPrice()
bond_market_price = 95.00   # Clean market price

compounding = ql.Compounded
# compounding = ql.Continuous

settle_date = fixed_rate_bond.settlementDate(calc_date)
day_counter = fixed_rate_bond.dayCounter()

print('day_counter =', day_counter)
print('coupon_freq =', coupon_freq)
print('calc_date =', calc_date)
print('settle_date =', settle_date)


implied_yield = fixed_rate_bond.bondYield(bond_market_price, day_counter, compounding, coupon_freq, settle_date) * 100
print('implied_yield =', round(implied_yield, 4))
```

    day_counter = Actual/Actual (ISMA) day counter
    coupon_freq = 2
    calc_date = April 2nd, 2024
    settle_date = April 3rd, 2024
    implied_yield = 5.4076

# 7. Analytical Duration, Convexity and Z-Spread (flat yield model)
## a. Compute bond duration, convexity and Z-Spread

```python
# flat_bond_yield (used as an input to compute duration and convexity)
flat_bond_yield = 5.5 # in pct
flat_bond_yield_rate = ql.InterestRate(flat_bond_yield/100, day_count, compounding, coupon_freq)

# Calc Duration and Convexity
bond_duration = ql.BondFunctions.duration(fixed_rate_bond, flat_bond_yield_rate)
bond_convexity = ql.BondFunctions.convexity(fixed_rate_bond, flat_bond_yield_rate)

# Calc z-spread for a given market price
bond_market_price = 95.3194     # Clean market price, implies zero Z-Spread!
bond_market_price = 95          # Test market price, implies Z-Spread > 0
bond_zspread = ql.BondFunctions.zSpread(fixed_rate_bond, bond_market_price, flat_yield_curve, day_count, compounding, coupon_freq, settle_date)

# Print results
print('Bond Duration =', round(bond_duration, 4))
print('Bond Convexity =', round(bond_convexity, 4))
print('Bond Z-Spread bps =', round(bond_zspread * 10000, 4))

```

    Bond Duration = 3.6247
    Bond Convexity = 15.4882
    Bond Z-Spread bps = 26.5978

## b. Validate Z-Spread

```python
def calc_clean_price_with_zspread(fixed_rate_bond, yield_curve_handle, zspread):
    zspread_quote = ql.SimpleQuote(zspread)
    zspread_quote_handle = ql.QuoteHandle(zspread_quote)
    yield_curve_bumped = ql.ZeroSpreadedTermStructure(yield_curve_handle, zspread_quote_handle, ql.Compounded, ql.Semiannual)
    yield_curve_bumped_handle = ql.YieldTermStructureHandle(yield_curve_bumped)
    
    # Set Valuation engine
    bond_engine = ql.DiscountingBondEngine(yield_curve_bumped_handle)
    fixed_rate_bond.setPricingEngine(bond_engine)
    bond_clean_price = fixed_rate_bond.cleanPrice()
    return bond_clean_price

```

```python
# Compare the original and the z-spread computed clean prices
bond_zspread_price = calc_clean_price_with_zspread(fixed_rate_bond, flat_yield_curve_handle, bond_zspread)

print('Bond Z-Spread bps =', round(bond_zspread * 10000, 2))
print('bond_market_price =', bond_market_price)
print('bond_zspread_price =', bond_zspread_price)
print('bond price diff =', bond_zspread_price - bond_market_price)
```

    Bond Z-Spread bps = 26.6
    bond_market_price = 95
    bond_zspread_price = 94.99999999999486
    bond price diff = -5.144329406903125e-12

# 8. Treasury Yield Curve Calibration (via Bootstrapping)
## a. Calibrate treasury flat yield curve (simple case of one calibration instrument)

```python
# fixed_rate_bond: 4% coupon and 2028-04-02 maturity

# clean price quote
tsy_clean_price_quote = 96.0
tsy_clean_price_handle = ql.QuoteHandle(ql.SimpleQuote(tsy_clean_price_quote))


# Create BondHelper object
bond_helper = ql.BondHelper(
    tsy_clean_price_handle,
    fixed_rate_bond)

bond_helper_list = [bond_helper]
        
tsy_flat_yield_curve = ql.PiecewiseLogCubicDiscount(calc_date, bond_helper_list, day_count)
tsy_flat_yield_curve.enableExtrapolation()

tsy_yield_curve_handle = ql.YieldTermStructureHandle(tsy_flat_yield_curve)

```

## b. Display the calibrated Treasury discount curve dataframe

```python
def get_yield_curve_details_df(yield_curve, curve_dates=None):
    
    if(curve_dates == None):
        curve_dates = yield_curve.dates()

    dates = [d.to_date() for d in curve_dates]
    discounts = [round(yield_curve.discount(d), 3) for d in curve_dates]
    yearfracs = [round(yield_curve.timeFromReference(d), 3) for d in curve_dates]
    zeroRates = [round(yield_curve.zeroRate(d, yield_curve.dayCounter(), ql.Compounded).rate() * 100, 3) for d in curve_dates]

    yield_curve_details_df = pd.DataFrame(data={'Date': dates,
                             'YearFrac': yearfracs,
                             'DiscountFactor': discounts,
                             'ZeroRate': zeroRates})                             
    return yield_curve_details_df
```

```python
# Display Treasury yield curve details
tsy_flat_yield_curve_simple_df = get_yield_curve_details_df(tsy_flat_yield_curve)                  # using calibration grid
print(tsy_flat_yield_curve_simple_df)

grid_dates = [tsy_flat_yield_curve.referenceDate() + ql.Period(y, ql.Years) for y in list(range(0,30,2))]
tsy_flat_yield_curve_details_df = get_yield_curve_details_df(tsy_flat_yield_curve, grid_dates)    # using external grid
print(tsy_flat_yield_curve_details_df)

```

             Date  YearFrac  DiscountFactor  ZeroRate
    0  2024-04-02       0.0           1.000     5.185
    1  2028-04-02       4.0           0.817     5.185
              Date  YearFrac  DiscountFactor  ZeroRate
    0   2024-04-02       0.0           1.000     5.185
    1   2026-04-02       2.0           0.904     5.185
    2   2028-04-02       4.0           0.817     5.185
    3   2030-04-02       6.0           0.738     5.185
    4   2032-04-02       8.0           0.667     5.185
    5   2034-04-02      10.0           0.603     5.185
    6   2036-04-02      12.0           0.545     5.185
    7   2038-04-02      14.0           0.493     5.185
    8   2040-04-02      16.0           0.445     5.185
    9   2042-04-02      18.0           0.403     5.185
    10  2044-04-02      20.0           0.364     5.185
    11  2046-04-02      22.0           0.329     5.185
    12  2048-04-02      24.0           0.297     5.185
    13  2050-04-02      26.0           0.269     5.185
    14  2052-04-02      28.0           0.243     5.185

## c. Plot the calibrated Treasury Zero Rates and Discount Factors curves

```python
plt = tsy_flat_yield_curve_details_df.plot(x='Date', y='ZeroRate', grid=True, style='*-', title='Treasury Flat Curve: Zero Rates', figsize=(12,4))
plt.set_ylabel('Zero Rate (%)')
plt.set_xlabel('Date')

plt = tsy_flat_yield_curve_details_df.plot(x='Date', y='DiscountFactor', grid=True, style='*-', title='Treasury Flat Curve: Discount Factors', figsize=(12,4))
plt.set_ylabel('Discount Factors')
plt.set_xlabel('Date')
```

    Text(0.5, 0, 'Date')




    

![png](output_100_1.png)

![png](output_100_2.png)

## d. Reprice the bond on the yield curve to validate the calibration 

```python
# 1. Price risk-free bond
risk_free_bond_engine = ql.DiscountingBondEngine(tsy_yield_curve_handle)

fixed_rate_bond.setPricingEngine(risk_free_bond_engine)
risk_free_bond_price = fixed_rate_bond.cleanPrice()
risk_free_bond_yield = fixed_rate_bond.bondYield(risk_free_bond_price, day_counter, compounding, coupon_freq, settle_date) * 100

print('tsy_clean_price_quote:', tsy_clean_price_quote)
print('risk_free_bond_price:', risk_free_bond_price)
print('price_calibration_error:', risk_free_bond_price-tsy_clean_price_quote)
print('risk_free_bond_yield:', risk_free_bond_yield)

```

    tsy_clean_price_quote: 96.0
    risk_free_bond_price: 96.0
    price_calibration_error: 0.0
    risk_free_bond_yield: 5.119227409362794

<hr><font color="green"><h1>from file: 3UChicago_FINM_35700_CreditMarkets_Spring2024_Solution_2</h1></font>

# Homework 2

## FINM 35700 - Spring 2024

### UChicago Financial Mathematics

### Due Date: 2024-04-16

* Alex Popovici
* alex.popovici@uchicago.edu

This homework relies on:

- the corporate and government bonds symbology file `bond_symbology`, 
- the "on-the-run" treasuries data file `govt_on_the_run`,
- the bond market data file `bond_market_prices_eod`, containing EOD price data as of 2024-04-08.

# Problem 1: Constructing fixed rate bonds

```python
import QuantLib as ql
import pandas as pd
import datetime as dt

# Use static calculation/valuation date of 2024-04-08, matching data available in the market prices EOD file
calc_date = ql.Date(8, 4, 2024)
ql.Settings.instance().evaluationDate = calc_date
```

## a. Prepare the symbology and market data files for fixed rate government and corporate bonds

Load the `bond_symbology`, `bond_market_prices_eod` and `govt_on_the_run` Excel files into dataframes. 

Filter the symbology frame for fixed rate bonds only (cpn_type="FIXED").

```python
# Set as-of-date
as_of_date = pd.to_datetime('2024-04-08')

# Load bond_symbology.xlsx
bond_symbology  = pd.read_excel('./data/bond_symbology.xlsx')
bond_symbology  = bond_symbology[bond_symbology['cpn_type'] == 'FIXED']

# Add term and TTM columns
bond_symbology['term'] = (bond_symbology['maturity'] - bond_symbology['start_date']).dt.days / 365.25
bond_symbology['TTM'] = (bond_symbology['maturity'] - as_of_date).dt.days / 365.25
display(bond_symbology.head())


# Load bond_market_prices_eod
bond_market_prices_eod = pd.read_excel('./data/bond_market_prices_eod.xlsx')

# Add mid prices and yields
bond_market_prices_eod['midPrice'] = 0.5*(bond_market_prices_eod['bidPrice'] + bond_market_prices_eod['askPrice'])
bond_market_prices_eod['midYield'] = 0.5*(bond_market_prices_eod['bidYield'] + bond_market_prices_eod['askYield'])
display(bond_market_prices_eod.head())

bond_symbology

# Load govt_on_the_run, as of 2024-04-08
govt_on_the_run = pd.read_excel('./data/govt_on_the_run.xlsx')

# Keep OTR treasuries only
govt_on_the_run_simple = govt_on_the_run[~govt_on_the_run['ticker'].str.contains('B|C')]
display(govt_on_the_run_simple.head())

```

<div>
<style scoped>
	.dataframe tbody tr th:only-of-type {
		vertical-align: middle;
	}

    .dataframe tbody tr th {
        vertical-align: top;
    }

    .dataframe thead th {
        text-align: right;
    }
</style>
<table border="1" class="dataframe">
  <thead>
	<tr style="text-align: right;">
	  <th></th>
	  <th>ticker</th>
	  <th>class</th>
	  <th>figi</th>
	  <th>isin</th>
	  <th>und_bench_isin</th>
	  <th>security</th>
	  <th>name</th>
	  <th>type</th>
	  <th>coupon</th>
	  <th>cpn_type</th>
	  <th>…</th>
	  <th>acc_first</th>
	  <th>maturity</th>
	  <th>mty_typ</th>
	  <th>rank</th>
	  <th>amt_out</th>
	  <th>country</th>
	  <th>currency</th>
	  <th>status</th>
	  <th>term</th>
	  <th>TTM</th>
	</tr>
  </thead>
  <tbody>
	<tr>
	  <th>0</th>
	  <td>AAPL</td>
	  <td>Corp</td>
	  <td>BBG004HST0K7</td>
	  <td>US037833AL42</td>
	  <td>US912810TZ12</td>
	  <td>AAPL 3.85 05/04/43</td>
	  <td>APPLE INC</td>
	  <td>GLOBAL</td>
	  <td>3.850</td>
	  <td>FIXED</td>
	  <td>…</td>
	  <td>2013-05-03</td>
	  <td>2043-05-04</td>
	  <td>AT MATURITY</td>
	  <td>Sr Unsecured</td>
	  <td>3000.0</td>
	  <td>US</td>
	  <td>USD</td>
	  <td>ACTV</td>
	  <td>30.001369</td>
	  <td>19.069131</td>
	</tr>
	<tr>
	  <th>1</th>
	  <td>AAPL</td>
	  <td>Corp</td>
	  <td>BBG006F8VWJ7</td>
	  <td>US037833AT77</td>
	  <td>US912810TZ12</td>
	  <td>AAPL 4.45 05/06/44</td>
	  <td>APPLE INC</td>
	  <td>GLOBAL</td>
	  <td>4.450</td>
	  <td>FIXED</td>
	  <td>…</td>
	  <td>2014-05-06</td>
	  <td>2044-05-06</td>
	  <td>AT MATURITY</td>
	  <td>Sr Unsecured</td>
	  <td>1000.0</td>
	  <td>US</td>
	  <td>USD</td>
	  <td>ACTV</td>
	  <td>30.001369</td>
	  <td>20.076660</td>
	</tr>
	<tr>
	  <th>2</th>
	  <td>AAPL</td>
	  <td>Corp</td>
	  <td>BBG0081TNL50</td>
	  <td>US037833BA77</td>
	  <td>US912810TZ12</td>
	  <td>AAPL 3.45 02/09/45</td>
	  <td>APPLE INC</td>
	  <td>GLOBAL</td>
	  <td>3.450</td>
	  <td>FIXED</td>
	  <td>…</td>
	  <td>2015-02-09</td>
	  <td>2045-02-09</td>
	  <td>AT MATURITY</td>
	  <td>Sr Unsecured</td>
	  <td>2000.0</td>
	  <td>US</td>
	  <td>USD</td>
	  <td>ACTV</td>
	  <td>30.001369</td>
	  <td>20.840520</td>
	</tr>
	<tr>
	  <th>3</th>
	  <td>AAPL</td>
	  <td>Corp</td>
	  <td>BBG008N1BQC1</td>
	  <td>US037833BH21</td>
	  <td>US912810TZ12</td>
	  <td>AAPL 4 3/8 05/13/45</td>
	  <td>APPLE INC</td>
	  <td>GLOBAL</td>
	  <td>4.375</td>
	  <td>FIXED</td>
	  <td>…</td>
	  <td>2015-05-13</td>
	  <td>2045-05-13</td>
	  <td>AT MATURITY</td>
	  <td>Sr Unsecured</td>
	  <td>2000.0</td>
	  <td>US</td>
	  <td>USD</td>
	  <td>ACTV</td>
	  <td>30.001369</td>
	  <td>21.095140</td>
	</tr>
	<tr>
	  <th>4</th>
	  <td>AAPL</td>
	  <td>Corp</td>
	  <td>BBG00C7QBCQ1</td>
	  <td>US037833BW97</td>
	  <td>US91282CJZ59</td>
	  <td>AAPL 4 1/2 02/23/36</td>
	  <td>APPLE INC</td>
	  <td>GLOBAL</td>
	  <td>4.500</td>
	  <td>FIXED</td>
	  <td>…</td>
	  <td>2016-02-23</td>
	  <td>2036-02-23</td>
	  <td>CALLABLE</td>
	  <td>Sr Unsecured</td>
	  <td>1250.0</td>
	  <td>US</td>
	  <td>USD</td>
	  <td>ACTV</td>
	  <td>20.000000</td>
	  <td>11.876797</td>
	</tr>
  </tbody>
</table>
<p>5 rows × 25 columns</p>
</div>

<div>
<style scoped>
	.dataframe tbody tr th:only-of-type {
		vertical-align: middle;
	}

    .dataframe tbody tr th {
        vertical-align: top;
    }

    .dataframe thead th {
        text-align: right;
    }
</style>
<table border="1" class="dataframe">
  <thead>
	<tr style="text-align: right;">
	  <th></th>
	  <th>date</th>
	  <th>class</th>
	  <th>ticker</th>
	  <th>isin</th>
	  <th>figi</th>
	  <th>bidPrice</th>
	  <th>askPrice</th>
	  <th>accrued</th>
	  <th>bidYield</th>
	  <th>askYield</th>
	  <th>midPrice</th>
	  <th>midYield</th>
	</tr>
  </thead>
  <tbody>
	<tr>
	  <th>0</th>
	  <td>2024-04-08</td>
	  <td>Corp</td>
	  <td>AAPL</td>
	  <td>US037833AL42</td>
	  <td>BBG004HST0K7</td>
	  <td>84.578</td>
	  <td>85.153</td>
	  <td>1.6685</td>
	  <td>5.127</td>
	  <td>5.074</td>
	  <td>84.8655</td>
	  <td>5.1005</td>
	</tr>
	<tr>
	  <th>1</th>
	  <td>2024-04-08</td>
	  <td>Corp</td>
	  <td>AAPL</td>
	  <td>US037833AT77</td>
	  <td>BBG006F8VWJ7</td>
	  <td>92.578</td>
	  <td>93.293</td>
	  <td>1.9045</td>
	  <td>5.042</td>
	  <td>4.982</td>
	  <td>92.9355</td>
	  <td>5.0120</td>
	</tr>
	<tr>
	  <th>2</th>
	  <td>2024-04-08</td>
	  <td>Corp</td>
	  <td>AAPL</td>
	  <td>US037833BA77</td>
	  <td>BBG0081TNL50</td>
	  <td>78.406</td>
	  <td>78.952</td>
	  <td>0.5850</td>
	  <td>5.152</td>
	  <td>5.102</td>
	  <td>78.6790</td>
	  <td>5.1270</td>
	</tr>
	<tr>
	  <th>3</th>
	  <td>2024-04-08</td>
	  <td>Corp</td>
	  <td>AAPL</td>
	  <td>US037833BH21</td>
	  <td>BBG008N1BQC1</td>
	  <td>90.009</td>
	  <td>90.602</td>
	  <td>1.7865</td>
	  <td>5.157</td>
	  <td>5.108</td>
	  <td>90.3055</td>
	  <td>5.1325</td>
	</tr>
	<tr>
	  <th>4</th>
	  <td>2024-04-08</td>
	  <td>Corp</td>
	  <td>AAPL</td>
	  <td>US037833BW97</td>
	  <td>BBG00C7QBCQ1</td>
	  <td>97.413</td>
	  <td>97.894</td>
	  <td>0.5875</td>
	  <td>4.788</td>
	  <td>4.733</td>
	  <td>97.6535</td>
	  <td>4.7605</td>
	</tr>
  </tbody>
</table>
</div>

<div>
<style scoped>
	.dataframe tbody tr th:only-of-type {
		vertical-align: middle;
	}

    .dataframe tbody tr th {
        vertical-align: top;
    }

    .dataframe thead th {
        text-align: right;
    }
</style>
<table border="1" class="dataframe">
  <thead>
	<tr style="text-align: right;">
	  <th></th>
	  <th>ticker</th>
	  <th>date</th>
	  <th>figi</th>
	  <th>isin</th>
	</tr>
  </thead>
  <tbody>
	<tr>
	  <th>0</th>
	  <td>GT10 Govt</td>
	  <td>2024-04-08</td>
	  <td>BBG01L8YJFB3</td>
	  <td>US91282CJZ59</td>
	</tr>
	<tr>
	  <th>3</th>
	  <td>GT2 Govt</td>
	  <td>2024-04-08</td>
	  <td>BBG01M44ZLG5</td>
	  <td>US91282CKH33</td>
	</tr>
	<tr>
	  <th>4</th>
	  <td>GT20 Govt</td>
	  <td>2024-04-08</td>
	  <td>BBG01LK8Y0L1</td>
	  <td>US912810TZ12</td>
	</tr>
	<tr>
	  <th>9</th>
	  <td>GT3 Govt</td>
	  <td>2024-04-08</td>
	  <td>BBG01LW4R927</td>
	  <td>US91282CKE02</td>
	</tr>
	<tr>
	  <th>10</th>
	  <td>GT30 Govt</td>
	  <td>2024-04-08</td>
	  <td>BBG01L8YJKX8</td>
	  <td>US912810TX63</td>
	</tr>
  </tbody>
</table>
</div>

## b. Add function to construct generic fixed rate cashflow schedules from symbology data

Use one row of the symbology dataframe as input  to the function. Use the helper function to convert a date string to a QuantLib date object.

```python
def get_ql_date(date) -> ql.Date:
    """
    convert dt.date to ql.Date
    """
    if isinstance(date, dt.date):
        return ql.Date(date.day, date.month, date.year)
    elif isinstance(date, str):
        date = dt.datetime.strptime(date, "%Y-%m-%d").date()
        return ql.Date(date.day, date.month, date.year)
    else:
        raise ValueError(f"to_qldate, {type(date)}, {date}")
```

```python
def create_schedule_from_symbology(details: dict):
    '''Create a QuantLib cashflow schedule from symbology details dictionary (usually one row of the symbology dataframe)
    '''
    
    # Create maturity from details['maturity']
    maturity = get_ql_date(details['maturity'])
    
    # Create acc_first from details['acc_first']
    acc_first =  get_ql_date(details['acc_first'])
    
    # Create calendar for Corp and Govt asset classes
    calendar = ql.UnitedStates(ql.UnitedStates.GovernmentBond)
    
    # define period from details['cpn_freq'] ... can be hard-coded to 2 = semi-annual frequency
    period = ql.Period(2)
    
    # business_day_convention
    business_day_convention = ql.Unadjusted
    
    # termination_date_convention
    termination_date_convention = ql.Unadjusted
    
    # date_generation
    date_generation=ql.DateGeneration.Backward
    
    # Create schedule using ql.MakeSchedule interface (with keyword arguments)
    schedule = ql.MakeSchedule(effectiveDate=acc_first,  # this may not be the same as the bond's start date
                            terminationDate=maturity,
                            tenor=period,
                            calendar=calendar,
                            convention=business_day_convention,
                            terminalDateConvention=termination_date_convention,
                            rule=date_generation,
                            endOfMonth=True,
                            firstDate=ql.Date(),
                            nextToLastDate=ql.Date())
    return schedule
```

```python
# Use one row of the symbology dataframe as input to the create_schedule_from_symbology() function.
corp_bond_details = bond_symbology[bond_symbology['class'] == 'Corp'].iloc[10]
print("Corp bond details for", corp_bond_details['security'])
display(corp_bond_details)

# Create cashflow_schedule
cashflow_schedule = create_schedule_from_symbology(corp_bond_details)
print("Cashflow dates for", corp_bond_details['security'])

# List cashflow dates
for date in cashflow_schedule:
        print(date)


```

    Corp bond details for AAPL 3.35 02/09/27



    ticker                           AAPL
    class                            Corp
    figi                     BBG00FXTS8Z0
    isin                     US037833CJ77
    und_bench_isin           US91282CKE02
    security           AAPL 3.35 02/09/27
    name                        APPLE INC
    type                           GLOBAL
    coupon                           3.35
    cpn_type                        FIXED
    dcc                            30/360
    cpn_freq                            2
    days_settle                         2
    start_date        2017-02-09 00:00:00
    cpn_first         2017-08-09 00:00:00
    acc_first         2017-02-09 00:00:00
    maturity          2027-02-09 00:00:00
    mty_typ                      CALLABLE
    rank                     Sr Unsecured
    amt_out                        2250.0
    country                            US
    currency                          USD
    status                           ACTV
    term                         9.998631
    TTM                          2.839151
    Name: 10, dtype: object


    Cashflow dates for AAPL 3.35 02/09/27
    February 9th, 2017
    August 9th, 2017
    February 9th, 2018
    August 9th, 2018
    February 9th, 2019
    August 9th, 2019
    February 9th, 2020
    August 9th, 2020
    February 9th, 2021
    August 9th, 2021
    February 9th, 2022
    August 9th, 2022
    February 9th, 2023
    August 9th, 2023
    February 9th, 2024
    August 9th, 2024
    February 9th, 2025
    August 9th, 2025
    February 9th, 2026
    August 9th, 2026
    February 9th, 2027

## c. Add function to construct generic fixed rate bond objects from symbology data

Use one row of the symbology dataframe as input to the function. Use create_schedule_from_symbology() internally to create the cashflow schedule.

```python
def create_bond_from_symbology(details: dict):
    '''Create a US fixed rate bond object from symbology details dictionary (usually one row of the symbology dataframe)
    '''
    
     # Create day_count from details['dcc']
     # For US Treasuries use ql.ActualActual(ql.ActualActual.ISMA)
     # For US Corporate bonds use ql.Thirty360(ql.Thirty360.USA)
    
    if details['class'] == 'Corp':
        day_count = ql.Thirty360(ql.Thirty360.USA)
    elif details['class'] == 'Govt':
        day_count = ql.ActualActual(ql.ActualActual.ISMA)
    else:
        raise ValueError(f"unsupported asset class, {type(details['class'])}, {details['class']}")

    
    # Create issue_date from details['start_date']
    issue_date = get_ql_date(details['start_date'])
    
    # Create days_settle from details['days_settle']
    days_settle = int(float(details['days_settle']))

    # Create coupon from details['coupon']
    coupon = float(details['coupon'])/100.


    # Create cashflow schedule
    schedule = create_schedule_from_symbology(details)
    
    face_value = 100
    redemption = 100
    
    payment_convention = ql.Unadjusted
        
    # Create fixed rate bond object
    fixed_rate_bond = ql.FixedRateBond(
        days_settle,
        face_value,
        schedule,
        [coupon],
        day_count,
        payment_convention,
        redemption,
        issue_date)        

    return fixed_rate_bond

```

```python
# Use one row of the symbology dataframe as input to the function.
corp_bond_object = create_bond_from_symbology(corp_bond_details)

print("Corp bond object details for", corp_bond_details['security'])
print('Start date:', corp_bond_object.startDate())
print('Maturity date:', corp_bond_object.maturityDate())
print('Bond face notional:', corp_bond_object.notional())

```

    Corp bond object details for AAPL 3.35 02/09/27
    Start date: February 9th, 2017
    Maturity date: February 9th, 2027
    Bond face notional: 100.0

## d. Add function that returns a dataframe with (future) cash flows details for a bond object

Use the "Investigate Bond Cashflows" section in the Quantlib Basic notebook as a template.

The results dataframe should contain following columns:

| CashFlowDate | CashFlowAmount | CashFlowYearFrac |
|----------|-------|-------------|

Pick one government and one corporate bond from symbology, create the bond objects and display the future cashflows.

```python
def get_bond_cashflows(bond: ql.FixedRateBond, calc_date=ql.Date) -> pd.DataFrame:
    '''Returns all future cashflows as of calc_date, i.e. with payment dates > calc_date.
    '''    
    day_counter = bond.dayCounter()    
    
    x = [(cf.date(), day_counter.yearFraction(calc_date, cf.date()), cf.amount()) for cf in bond.cashflows()]
    cf_date, cf_yearFrac, cf_amount = zip(*x)
    cashflows_df = pd.DataFrame(data={'CashFlowDate': cf_date, 'CashFlowYearFrac': cf_yearFrac, 'CashFlowAmount': cf_amount})

    # filter for payment dates > calc_date
    cashflows_df = cashflows_df[cashflows_df.CashFlowYearFrac > 0]
    return cashflows_df

```

```python
# Pick one government and one corporate bond from symbology, create the bond objects.
govt_bond_details = bond_symbology[bond_symbology['class'] == 'Govt'].iloc[10]
print("Govt bond details for", govt_bond_details['security'])
display(govt_bond_details)

# Create govt_bond_object
govt_bond_object = create_bond_from_symbology(govt_bond_details)
```

    Govt bond details for T 5 1/4 11/15/28



    ticker                              T
    class                            Govt
    figi                     BBG000FJ0QD9
    isin                     US912810FF04
    und_bench_isin           US91282CKG59
    security             T 5 1/4 11/15/28
    name                  US TREASURY N/B
    type                    US GOVERNMENT
    coupon                           5.25
    cpn_type                        FIXED
    dcc                           ACT/ACT
    cpn_freq                            2
    days_settle                         1
    start_date        1998-11-16 00:00:00
    cpn_first         1999-05-15 00:00:00
    acc_first         1998-11-15 00:00:00
    maturity          2028-11-15 00:00:00
    mty_typ                        NORMAL
    rank                        Unsecured
    amt_out                       10947.0
    country                            US
    currency                          USD
    status                           ACTV
    term                        29.998631
    TTM                          4.605065
    Name: 341, dtype: object

```python
# Govt bond: display the future cashflows.
print("Govt bond future cashflows for", govt_bond_details['security'])
govt_bond_cf = get_bond_cashflows(govt_bond_object, calc_date=calc_date)
display(govt_bond_cf)

# Corp bond: display the future cashflows.
print("Corp bond future cashflows for", corp_bond_details['security'])
corp_bond_cf = get_bond_cashflows(corp_bond_object, calc_date=calc_date)
display(corp_bond_cf)
```

    Govt bond future cashflows for T 5 1/4 11/15/28

<div>
<style scoped>
	.dataframe tbody tr th:only-of-type {
		vertical-align: middle;
	}

    .dataframe tbody tr th {
        vertical-align: top;
    }

    .dataframe thead th {
        text-align: right;
    }
</style>
<table border="1" class="dataframe">
  <thead>
	<tr style="text-align: right;">
	  <th></th>
	  <th>CashFlowDate</th>
	  <th>CashFlowYearFrac</th>
	  <th>CashFlowAmount</th>
	</tr>
  </thead>
  <tbody>
	<tr>
	  <th>50</th>
	  <td>May 15th, 2024</td>
	  <td>0.083333</td>
	  <td>2.625</td>
	</tr>
	<tr>
	  <th>51</th>
	  <td>November 15th, 2024</td>
	  <td>0.583333</td>
	  <td>2.625</td>
	</tr>
	<tr>
	  <th>52</th>
	  <td>May 15th, 2025</td>
	  <td>1.083333</td>
	  <td>2.625</td>
	</tr>
	<tr>
	  <th>53</th>
	  <td>November 15th, 2025</td>
	  <td>1.583333</td>
	  <td>2.625</td>
	</tr>
	<tr>
	  <th>54</th>
	  <td>May 15th, 2026</td>
	  <td>2.083333</td>
	  <td>2.625</td>
	</tr>
	<tr>
	  <th>55</th>
	  <td>November 15th, 2026</td>
	  <td>2.583333</td>
	  <td>2.625</td>
	</tr>
	<tr>
	  <th>56</th>
	  <td>May 15th, 2027</td>
	  <td>3.083333</td>
	  <td>2.625</td>
	</tr>
	<tr>
	  <th>57</th>
	  <td>November 15th, 2027</td>
	  <td>3.583333</td>
	  <td>2.625</td>
	</tr>
	<tr>
	  <th>58</th>
	  <td>May 15th, 2028</td>
	  <td>4.083333</td>
	  <td>2.625</td>
	</tr>
	<tr>
	  <th>59</th>
	  <td>November 15th, 2028</td>
	  <td>4.583333</td>
	  <td>2.625</td>
	</tr>
	<tr>
	  <th>60</th>
	  <td>November 15th, 2028</td>
	  <td>4.583333</td>
	  <td>100.000</td>
	</tr>
  </tbody>
</table>
</div>

    Corp bond future cashflows for AAPL 3.35 02/09/27

<div>
<style scoped>
	.dataframe tbody tr th:only-of-type {
		vertical-align: middle;
	}

    .dataframe tbody tr th {
        vertical-align: top;
    }

    .dataframe thead th {
        text-align: right;
    }
</style>
<table border="1" class="dataframe">
  <thead>
	<tr style="text-align: right;">
	  <th></th>
	  <th>CashFlowDate</th>
	  <th>CashFlowYearFrac</th>
	  <th>CashFlowAmount</th>
	</tr>
  </thead>
  <tbody>
	<tr>
	  <th>14</th>
	  <td>August 9th, 2024</td>
	  <td>0.336111</td>
	  <td>1.675</td>
	</tr>
	<tr>
	  <th>15</th>
	  <td>February 9th, 2025</td>
	  <td>0.836111</td>
	  <td>1.675</td>
	</tr>
	<tr>
	  <th>16</th>
	  <td>August 9th, 2025</td>
	  <td>1.336111</td>
	  <td>1.675</td>
	</tr>
	<tr>
	  <th>17</th>
	  <td>February 9th, 2026</td>
	  <td>1.836111</td>
	  <td>1.675</td>
	</tr>
	<tr>
	  <th>18</th>
	  <td>August 9th, 2026</td>
	  <td>2.336111</td>
	  <td>1.675</td>
	</tr>
	<tr>
	  <th>19</th>
	  <td>February 9th, 2027</td>
	  <td>2.836111</td>
	  <td>1.675</td>
	</tr>
	<tr>
	  <th>20</th>
	  <td>February 9th, 2027</td>
	  <td>2.836111</td>
	  <td>100.000</td>
	</tr>
  </tbody>
</table>
</div>

# Problem 2: US Treasury yield curve calibration (On-The-Runs)

## a. Create the on-the-run US treasury bond objects

Restrict the symbology + market data dataframe to "on-the-run"/OTR US treasury notes/bonds only and create the treasury bond objects.

Extend the treasuries symbology dataframe with the following market data columns (code from Homework 1):

| date | bidPrice | askPrice | midPrice | bidYield | askYield | midYield | term | TTM |
|----------|-------|-------------|-----|----------|---------|---------|---------|---------|

Plot a graph/scatter plot of on-the-run treasury mid yields by TTM.

```python
# Create symbology for on-the-run treasuries only
govt_symbology_otr = bond_symbology[bond_symbology['isin'].isin(govt_on_the_run_simple['isin'])].copy()
govt_symbology_otr = govt_symbology_otr.sort_values(by='TTM')

# Merge market data as of 2024-04-01 into treasury OTR symbology
govt_combined_otr = govt_symbology_otr.merge(bond_market_prices_eod,  on=['class','ticker','figi','isin'])

# Plot a graph/scatter plot of treasury OTR mid yields by TTM
govt_combined_otr.plot(x='TTM', y='midYield', grid=True, style='*-', title='OTR US Treasury yields by TTM', figsize=(12,4))
```

    <Axes: title={'center': 'OTR US Treasury yields by TTM'}, xlabel='TTM'>




    

![png](output_123_1.png)

## b. Calibrate the on-the-run treasury yield curve (bootstrapping)

The function below shows how to calibrate a smooth yield/discount factor curve from the on-the-run treasury dataframe. 

Calibrate the bid, ask and mid discount factor curves as of 2024-04-08.

Display the calibration results for the mid curve, using get_yield_curve_details_df().

```python
def calibrate_yield_curve_from_frame(
        calc_date: ql.Date,
        treasury_details: pd.DataFrame,
        price_quote_column: str):
    '''Create a calibrated yield curve from a details dataframe which includes bid/ask/mid price quotes.
    '''
    ql.Settings.instance().evaluationDate = calc_date

    # Sort dataframe by maturity
    sorted_details_frame = treasury_details.sort_values(by='maturity')    
    
    # For US Treasuries use ql.ActualActual(ql.ActualActual.ISMA)
    day_count = ql.ActualActual(ql.ActualActual.ISMA)

    bond_helpers = []
    
    for index, row in sorted_details_frame.iterrows():
        bond_object = create_bond_from_symbology(row)
        
        tsy_clean_price_quote = row[price_quote_column]
        tsy_clean_price_handle = ql.QuoteHandle(ql.SimpleQuote(tsy_clean_price_quote))
        
        bond_helper = ql.BondHelper(tsy_clean_price_handle, bond_object)
        bond_helpers.append(bond_helper)
        
    yield_curve = ql.PiecewiseLogCubicDiscount(calc_date, bond_helpers, day_count)
    # yield_curve = ql.PiecewiseFlatForward(calc_date, bond_helpers, day_count)
    
    yield_curve.enableExtrapolation()
    return yield_curve



def get_yield_curve_details_df(yield_curve, curve_dates=None):
    
    if(curve_dates == None):
        curve_dates = yield_curve.dates()

    dates = [d.to_date() for d in curve_dates]
    discounts = [round(yield_curve.discount(d), 3) for d in curve_dates]
    yearfracs = [round(yield_curve.timeFromReference(d), 3) for d in curve_dates]
    zeroRates = [round(yield_curve.zeroRate(d, yield_curve.dayCounter(), ql.Compounded).rate() * 100, 3) for d in curve_dates]

    yield_curve_details_df = pd.DataFrame(data={'Date': dates,
                             'YearFrac': yearfracs,
                             'DiscountFactor': discounts,
                             'ZeroRate': zeroRates})                             
    return yield_curve_details_df
```

```python
# Calibrate the bid, ask and mid discount factor curves as of 2024-04-08.
tsy_yield_curve_bid = calibrate_yield_curve_from_frame(calc_date, govt_combined_otr, 'bidPrice')
tsy_yield_curve_mid = calibrate_yield_curve_from_frame(calc_date, govt_combined_otr, 'midPrice')
tsy_yield_curve_ask = calibrate_yield_curve_from_frame(calc_date, govt_combined_otr, 'askPrice')

# Display the calibration results for the mid curve
tsy_yield_curve_df = get_yield_curve_details_df(tsy_yield_curve_mid)
display(tsy_yield_curve_df)

ql_dates_yearly = [calc_date + ql.Period(y, ql.Years) for y in list(range(0, 30, 1))]
tsy_yield_curve_monthly_df = get_yield_curve_details_df(tsy_yield_curve_mid, curve_dates=ql_dates_yearly)
display(tsy_yield_curve_monthly_df)

```

<div>
<style scoped>
	.dataframe tbody tr th:only-of-type {
		vertical-align: middle;
	}

    .dataframe tbody tr th {
        vertical-align: top;
    }

    .dataframe thead th {
        text-align: right;
    }
</style>
<table border="1" class="dataframe">
  <thead>
	<tr style="text-align: right;">
	  <th></th>
	  <th>Date</th>
	  <th>YearFrac</th>
	  <th>DiscountFactor</th>
	  <th>ZeroRate</th>
	</tr>
  </thead>
  <tbody>
	<tr>
	  <th>0</th>
	  <td>2024-04-08</td>
	  <td>0.000</td>
	  <td>1.000</td>
	  <td>4.883</td>
	</tr>
	<tr>
	  <th>1</th>
	  <td>2026-03-31</td>
	  <td>2.000</td>
	  <td>0.911</td>
	  <td>4.790</td>
	</tr>
	<tr>
	  <th>2</th>
	  <td>2027-03-15</td>
	  <td>2.917</td>
	  <td>0.875</td>
	  <td>4.683</td>
	</tr>
	<tr>
	  <th>3</th>
	  <td>2029-03-31</td>
	  <td>5.000</td>
	  <td>0.805</td>
	  <td>4.441</td>
	</tr>
	<tr>
	  <th>4</th>
	  <td>2031-03-31</td>
	  <td>7.000</td>
	  <td>0.737</td>
	  <td>4.455</td>
	</tr>
	<tr>
	  <th>5</th>
	  <td>2034-02-15</td>
	  <td>9.833</td>
	  <td>0.650</td>
	  <td>4.477</td>
	</tr>
	<tr>
	  <th>6</th>
	  <td>2044-02-15</td>
	  <td>19.833</td>
	  <td>0.396</td>
	  <td>4.786</td>
	</tr>
	<tr>
	  <th>7</th>
	  <td>2054-02-15</td>
	  <td>29.917</td>
	  <td>0.264</td>
	  <td>4.556</td>
	</tr>
  </tbody>
</table>
</div>

<div>
<style scoped>
	.dataframe tbody tr th:only-of-type {
		vertical-align: middle;
	}

    .dataframe tbody tr th {
        vertical-align: top;
    }

    .dataframe thead th {
        text-align: right;
    }
</style>
<table border="1" class="dataframe">
  <thead>
	<tr style="text-align: right;">
	  <th></th>
	  <th>Date</th>
	  <th>YearFrac</th>
	  <th>DiscountFactor</th>
	  <th>ZeroRate</th>
	</tr>
  </thead>
  <tbody>
	<tr>
	  <th>0</th>
	  <td>2024-04-08</td>
	  <td>0.0</td>
	  <td>1.000</td>
	  <td>4.883</td>
	</tr>
	<tr>
	  <th>1</th>
	  <td>2025-04-08</td>
	  <td>1.0</td>
	  <td>0.954</td>
	  <td>4.860</td>
	</tr>
	<tr>
	  <th>2</th>
	  <td>2026-04-08</td>
	  <td>2.0</td>
	  <td>0.911</td>
	  <td>4.790</td>
	</tr>
	<tr>
